,Category,Title
18044,Travel,Olympic Mountains: A Climbing Guide (Climbing Guide) 4th Edition
13135,Travel,Jordan: Images from the Air
41850,"Cookbooks, Food & Wine","The Skinny Ice Cream Maker: Delicious Lower Fat, Lower Calorie Ice Cream, Frozen Yogurt & Sorbet Recipes For Your Ice Cream Maker"
44080,"Cookbooks, Food & Wine","The Complete Trail Food Cookbook: Over 300 Recipes for Campers, Canoeists and Backpackers"
9716,Travel,Andorra Country Study Guide (World Country Study Guide
26009,Science & Math,Blue Future: Protecting Water for People and the Planet Forever
2737,Travel,Egyptian-Spice Bazaar in Istanbul
40562,"Cookbooks, Food & Wine",Microwave Dessert Cookbook: 34 Easy Microwave Recipes for Desserts
23851,Science & Math,"Giant Magnetoresistance (GMR) Sensors: From Basis to State-of-the-Art Applications (Smart Sensors, Measurement and Instrumentation)"
23651,Science & Math,"Scanning Electron Microscopy, X-Ray Microanalysis, and Analytical Electron Microscopy: A Laboratory Workbook"
28660,Romance,Everything Forbidden (Albright Sisters Series)
38294,"Cookbooks, Food & Wine","Ho'oulu ka 'Ulu Cookbook: Breadfruit tips, techniques, and Hawai'i's favorite home recipes"
15057,Travel,"Rand McNally 2004 Philadelphia 5-County Street Guide: Philadelphia, Bucks, Chester, Delaware, Montgomery : Spiral Binding (Rand McNally Street Guides)"
17608,Travel,Memphis Elvis-Style
12340,Travel,"Rome & the Vatican: Practical Guide: 2, 3 & 4 Day Visits (Baonechi travel guides)"
6306,Travel,Lonely Planet Discover Malaysia & Singapore (Travel Guide)
33118,Science & Math,Wildflowers of North America: A Guide to Field Identification
39207,"Cookbooks, Food & Wine",The Meatloaf Bakery Cookbook: Comfort Food with a Twist
3027,Travel,Volviendo de Africa (Spanish Edition)
36749,Travel,Lonely Planet Maldives (Travel Guide)
24517,Science & Math,Real Mathematical Analysis (Undergraduate Texts in Mathematics)
24070,Travel,"Time: Its Origin, Its Enigma, Its History"
1002,Travel,England National Geographic 2016 Wall Calendar
15181,Travel,Miami Beach Deco
14899,Travel,"Food Lovers' Guide to® Denver & Boulder: The Best Restaurants, Markets & Local Culinary Offerings (Food Lovers' Series)"
9382,Travel,VIVA Travel Guides Guatemala
21317,Science & Math,General Chemistry
5992,Travel,"Historical Atlas of Northeast Asia, 1590-2010: Korea, Manchuria, Mongolia, Eastern Siberia by Narangoa, Li, Cribb, Robert (2014) Hardcover"
41781,"Cookbooks, Food & Wine",Sea Salt Sweet: The Art of Using Salts for the Ultimate Dessert Experience
31664,Romance,Son of the Morning (Pocket Books Romance)
28463,Romance,Use (Songs of Perdition) (Volume 2)
33666,Sports & Outdoors,"Sight Alignment, Trigger Control & The Big Lie"
23964,Science & Math,"Practical Pyrometry: The Theory, Calibration and Use of Instruments for the Measurement of High Temperatures"
18384,Travel,The Sibley Guide to Trees
44906,"Cookbooks, Food & Wine",Indian: A Culinary Journey of Discovery
19088,"Cookbooks, Food & Wine",Shelf Life: Food Industry Briefing Series
6694,Travel,Lonely Planet Tailandia (Travel Guide) (Spanish Edition)
30645,Romance,An Amish Christmas Quilt
29701,Romance,Post Apocalypse: An Apocalypse Romance Novel (Volume 1)
29002,Romance,Chuck's Dinosaur Tinglers: Volume 1
32679,Sports & Outdoors,Simply the Best: Insights and Strategies from Great Hockey Coaches
25122,Science & Math,"The Infinite-Dimensional Topology of Function Spaces, Volume 64 (North-Holland Mathematical Library)"
21820,Science & Math,Photopolymerization: Fundamentals and Applications (ACS Symposium Series)
21278,Science & Math,"Manual of Mineral Science, 22nd Edition (Manual of Mineralogy)"
46096,"Cookbooks, Food & Wine","French Roots: Two Cooks, Two Countries, and the Beautiful Food along the Way"
11096,Travel,1001+ Basic Phrases English - Maltese
19200,Science & Math,History of Far Eastern Art (5th Edition)
3953,Travel,Durban & KwaZulu Natal Focus Guide (Footprint Focus)
7736,Travel,"Exploring Vancouver Island's West Coast, 2nd Ed."
44023,"Cookbooks, Food & Wine",Smokin' in the Boys' Room: Southern Recipes from the Winningest Woman in Barbecue
8783,Travel,Wisdom From Ole Time Jamaican People: Lessons From Jamaican Proverbs
24452,Science & Math,"Schaum's Outline: Probability and Statistics, Second Edition"
673,Travel,New York 2016 Michelin Guide (Michelin Guides)
16159,Travel,Detroit 1860-1899 (Images of America (Arcadia Publishing))
40302,"Cookbooks, Food & Wine","Healthy Cookbook for Two: 175 Simple, Delicious Recipes to Enjoy Cooking for Two"
22081,Science & Math,Electrical and Instrumentation Safety for Chemical Processes
23994,Science & Math,Visions: How Science Will Revolutionize the 21st Century
25027,Science & Math,"Math 3: An Incremental Development Set: Student Workbooks, part one and two plus flashcards (Saxon math, grade 3)"
8189,Travel,Inagua: An Island Sojourn (Wilder Places)
19004,Science & Math,"Soil Sampling and Methods of Analysis, Second Edition"
17631,Travel,"Old Money, New South: The Spirit of Chattanooga"
1080,"Cookbooks, Food & Wine","Easy Steps to Chinese Vol.1, Workbook, Simplified Characters Version"
13616,Travel,Moon Ecuador & the Galápagos Islands (Moon Handbooks)
15,Travel,Rick Steves London 2015
14379,Sports & Outdoors,100 Things Nebraska Fans Should Know & Do Before They Die (100 Things...Fans Should Know)
32706,Sports & Outdoors,Coaching Girls' Ice Hockey
24666,Science & Math,Computational Methods in Biometric Authentication: Statistical Methods for Performance Evaluation (Information Science and Statistics)
18458,Science & Math,Plant Breeding
30079,Travel,Semiramis - Conquering Queen
20910,Science & Math,"Process Validation in Manufacturing of Biopharmaceuticals, Third Edition (Biotechnology and Bioprocessing)"
25271,Science & Math,Last Chain On Billie: How One Extraordinary Elephant Escaped the Big Top
25398,Science & Math,The Ocean of Life: The Fate of Man and the Sea
12515,Science & Math,Cancun & the Yucatan For Dummies
32346,Sports & Outdoors,Play Baseball the Ripken Way: The Complete Illustrated Guide to the Fundamentals
6331,Travel,Singapore Slingshot: Adventures of an American Expat in Asia
20164,Science & Math,The Magic School Bus Explores the Senses
761,Travel,MICHELIN Guide France 2016: Hotels & Restaurants (French Edition)
41830,"Cookbooks, Food & Wine",Sugar Roses for Cakes
34898,Travel,Front Row Section D
38419,"Cookbooks, Food & Wine",Modern Thai Food: 100 Simple and Delicious Recipes from Sydney's Famous Longrain Restaurant
41371,"Cookbooks, Food & Wine",The Dairy-Free & Gluten-Free Kitchen
28878,Travel,Great-Aunt Sophia's Lessons for Bombshells
27699,Romance,Girl Underwater
18913,Science & Math,Soil and Water Conservation Engineering
28268,Travel,The Low Road
17214,Travel,"Indian Territory,: A frontier photographic record"
33190,Travel,Discovery Channel: Insects & Spiders: An Explore Your World Handbook
35120,Sports & Outdoors,"Between the Bylines:: The Life, Love & Loss of Los Angeles's Most Colorful Sports Journalist"
17050,Travel,Hiking Trails of the Joyce Kilmer-Slickrock and Citco Creek Wildernesses
16569,Science & Math,The Nature of Home: A Lexicon of Essays
21228,Science & Math,Computer Simulation Tools for X-ray Analysis: Scattering and Diffraction Methods (Graduate Texts in Physics)
26317,Science & Math,Applied Fluid Mechanics (6th Edition)
4514,Travel,Afghanistan
8462,Travel,An Island Called Home: Returning to Jewish Cuba
27469,Science & Math,"The Method of Moments in Electromagnetics, Second Edition"
43440,"Cookbooks, Food & Wine",The Ultimate Panini Press Cookbook: More Than 200 Perfect-Every-Time Recipes for Making Panini - and Lots of Other Things - on Your Panini Press or Other Countertop Grill
37912,"Cookbooks, Food & Wine","The Flavor Bible: The Essential Guide to Culinary Creativity, Based on the Wisdom of America's Most Imaginative Chefs"
31790,Romance,The Marine's E-Mail Order Bride
6904,Romance,"Speak Like a Thai, Vol. 4: Heart Words"
38242,"Cookbooks, Food & Wine",Mayumi's Kitchen: Macrobiotic Cooking for Body and Soul
32099,Travel,Raw Recruits
693,Travel,Tasting Kauai Restaurants: An Insider's Guide to Eating Well on the Garden Island
18133,Travel,The Milwaukee Bucket List: 101 Real Milwaukee Adventures
7072,Travel,Moon Handbooks Fiji
41359,Travel,Edible and Medicinal Mushrooms of New England and Eastern Canada
9057,Travel,"British Virgin Islands 1:110 000 / 75 000 Guide & Dive Map, waterproof, 2012 edition"
41901,"Cookbooks, Food & Wine",Taste of Home Holidays & Celebrations: 467 Recipes For Every Occassion
26256,Science & Math,Transient Chaos: Complex Dynamics on Finite Time Scales (Applied Mathematical Sciences)
13317,Travel,Through the Lion Gate: An American Woman Challenges the Traditions of a Veiled Society and Discovers a Daughter
38732,"Cookbooks, Food & Wine","Healthy Bread in Five Minutes a Day: 100 New Recipes Featuring Whole Grains, Fruits, Vegetables, and Gluten-Free Ingredients"
28489,Travel,Caparazones
28812,Romance,The Complete Fifty Shades of Alice
21524,Science & Math,"Practical Process Research and Development - A guide for Organic Chemists, Second Edition"
40862,"Cookbooks, Food & Wine","Low Carb Diet Cookbook Box Set:  3 Low Carb Books in 1, Low Carb Slow Cooker, Low Carb Dump Dinners & Low Carb Freezer Meals"
6090,Travel,"Pakistan 1:1,200,000 Travel Map (International Travel Maps)"
30982,Romance,The Ghost Network: A Novel
22994,Science & Math,Lake Superior Rocks & Minerals: A Field Guide to the Lake Superior Area
19212,Science & Math,"Ancient Greece: From Prehistoric to Hellenistic Times, Second Edition"
6782,Travel,DK Eyewitness Travel Guide: Greek Islands
42004,"Cookbooks, Food & Wine",Christmas from the Heart of the Home
8073,Travel,"Bonaire Reef Creatures Guide Franko Maps Laminated Fish Card 4"" x 6"""
27984,Travel,The Bachelor's Homecoming (Smoky Mountain Matches)
16066,Travel,Rand McNally Greater Boston Eastern Massachusetts Regional Map
10396,Travel,Moon Prague & Budapest (Moon Handbooks)
37645,Travel,Jungle: A Harrowing True Story of Survival
32961,Travel,Being James Bond: Volume One: Pocket Edition
26550,Science & Math,Entropy and Information Optics (Optical Science and Engineering)
4683,Travel,"Global Migrants, Local Lives: Travel and Transformation in Rural Bangladesh (Oxford Studies in Social and Cultural Anthropology)"
9531,Travel,Lonely Planet Panama (Country Travel Guide)
41667,Romance,Quinoa 365: The Everyday Superfood
26611,Science & Math,Foundations of Vacuum Science and Technology
5831,Travel,Norman Lewis Omnibus: A Dragon Apparent; Golden Earth; & A Goddess in the Stones
40507,Science & Math,Modern Garde Manger
19179,Travel,The Holy Land: An Oxford Archaeological Guide (Oxford Archaeological Guides)
5234,Travel,At Home in Bali
40103,"Cookbooks, Food & Wine",The True History of Chocolate
16860,Travel,"A Wandering Walk Guidebook: Albuquerque, NM"
37373,Sports & Outdoors,Table Tennis 2009: Rule Book
40100,"Cookbooks, Food & Wine",Fannie Farmer 1896 Cook Book
26447,Science & Math,"Accelerators, Linear to Analytic Methods, Volume 1, Encyclopedia of Applied Physics"
4409,Travel,"Lonely Planet Vietnam, Cambodia, Laos & Northern Thailand (Travel Guide)"
26072,Science & Math,Secret Science and the Secret Space Program
42046,"Cookbooks, Food & Wine",Our Favorite Christmas Recipes Cookbook: Over 60 of Our Favorite Christmas Recipes plus just as many handy tips and a new photo cover (Our Favorite Recipes Collection)
3020,Travel,Birds of Kenya's Rift Valley (WILDGuides)
25408,Travel,The Living Gulf Coast: A Nature Guide to Southwest Florida
44391,"Cookbooks, Food & Wine",Anna and Michael Olson Cook at Home
9821,Travel,Jaw-Dropping Geography: Fun Learning Facts About Awesome Austria: Illustrated Fun Learning For Kids (Jaw-Dropping GeographyJaw-Dropping Geography) (Volume 1)
25272,Science & Math,Citizen Canine: Our Evolving Relationship with Cats and Dogs
37590,Travel,A Young Softball Player's Guide to Fielding and Defense (Young Player's)
19995,Science & Math,Disasters in Field Research: Preparing for and Coping with Unexpected Events
18898,Science & Math,"Conserving Land, Protecting Water (Comprehensive Assessment of Water Management in Agriculture Series)"
2481,Travel,Central Cascades (National Geographic Destination Map)
2798,Travel,"Eritrea Ecology & Nature Protection Handbook (World Business, Investment and Government Library)"
35533,Sports & Outdoors,Drugs in Sport
4759,Travel,In the Kingdom of the Thunder Dragon
32002,Sports & Outdoors,High Five: Duke's Unforgettable 2015 Championship Season
29377,Romance,The American Soldier Collection 11: Mending Hearts (Siren Publishing LoveXtreme Forever)
32684,Romance,The Montreal Maroons: The Forgotten Stanley Cup Champions
15288,Travel,Hawaii The Big Island Guide Franko Maps Waterproof Map
42311,"Cookbooks, Food & Wine",Bridal Shower Games: Fun Party Games and Helpful Tips for the Hostess
42407,"Cookbooks, Food & Wine",Table Toppers
21067,Science & Math,Troubleshooting LC Systems: A Comprehensive Approach to Troubleshooting LC Equipment and Separations
46642,"Cookbooks, Food & Wine","The Colorado cook book: A benefit for the University of Colorado Libraries, Boulder"
45691,"Cookbooks, Food & Wine",Sodium Girl's Limitless Low-Sodium Cookbook
22468,Science & Math,"The New Madrid Earthquakes, Revised Edition"
45814,"Cookbooks, Food & Wine",JJ Virgin's Sugar Impact Diet Cookbook: 150 Low-Sugar Recipes to Help You Lose Up to 10 Pounds in Just 2 Weeks
22369,Science & Math,Climate Change: A Very Short Introduction (Very Short Introductions)
22006,Science & Math,The Physics of Block Copolymers (Oxford Science Publications)
13428,Travel,"Yemen Fb R (English, Spanish, French, Italian and German Edition)"
45307,"Cookbooks, Food & Wine","Sly Moves: My Proven Program to Lose Weight, Build Strength, Gain Will Power, and Live your Dream"
5560,Travel,Maldives Satellite Map
6289,Travel,Club Red: Vacation Travel and the Soviet Dream
30127,Romance,The Brightest Star in the Highlands: Jennie and Aedan ( Clan Grant Series) (Volume 7)
9232,Travel,The Gringos Guide To Driving Through   Mexico & Central America: Expanded Costa Rica Section 2011
24459,Science & Math,"Calculus: 1,001 Practice Problems For Dummies (+ Free Online Practice)"
16559,Travel,Omaha Impressions (Impressions (Farcountry Press))
1320,Travel,Walking the Beach to Bellingham (Northwest Reprints)
30282,Travel,Scandal in Scotland (The Hurst Amulet)
29308,Romance,Calder (Tales of the Shareem) (Volume 4)
22491,Travel,"The 1980 Eruptions of Mount St. Helens, Washington: Early Results of Studies of Volcanic Events in 1980, Geophysical Monitoring of Activity, and Studi (Geological Survey Professional Paper)"
30753,Romance,Beyond Tuesday Morning (September 11 Series #2)
1075,"Cookbooks, Food & Wine",Quick Spanish for Law Enforcement: Essential Words and Phrases for Police Officers and Law Enforcement Professionals
35750,Sports & Outdoors,Climber's Guide to Glacier National Park (Regional Rock Climbing Series)
13294,Science & Math,Fun Runs and Guns - Trips and Trails through Yemen and Saudi Arabia: Second Edition
1917,Travel,Travelling the World With MS...: ...in a Wheelchair
4565,Travel,"Lonely Planet Georgia, Armenia & Azerbaijan (Travel Guide)"
45160,Travel,La nueva dieta anti-cancer (Spanish Edition)
45312,"Cookbooks, Food & Wine",The Coumadin Cookbook: A Guide to Healthy Meals When Taking Coumadin
37965,"Cookbooks, Food & Wine","The Cancer-Fighting Kitchen: Nourishing, Big-Flavor Recipes for Cancer Treatment and Recovery"
37946,"Cookbooks, Food & Wine",Better Homes and Gardens New Junior Cook Book (Better Homes and Gardens Cooking)
27840,Travel,Enticing Winter (Bare Sophistication)
14444,Travel,Hiking Missouri - 2nd Edition (America's Best Day Hiking)
44437,Science & Math,Butterfly Messengers: True Stories of Comfort and Hope
20248,Science & Math,"Advances in Electromagnetic Fields in Living Systems, Volume 1"
16336,Travel,Exploring Coastal Mississippi: A Guide to the Marine Waters and Islands
14142,Travel,Guyana National Development Strategy Handbook
36074,Science & Math,Blood Sweat and Treason: My Story
14854,Travel,Monterey Peninsula:  The Golden Age   (CA)   (Images of America)
22368,Science & Math,Handbook of Climate Change Adaptation
42284,"Cookbooks, Food & Wine",Cook It French! Easy Recipes for Passover
23655,Science & Math,Scanning Electron Microscope Optics and Spectrometer
27525,Science & Math,The Canon: A Whirligig Tour of the Beautiful Basics of Science
18257,Travel,Moleskine City Notebook Washington DC
12498,Travel,Acapulco Map by Guia Roji (Spanish and English Edition)
38881,"Cookbooks, Food & Wine",The Gourmet Cookie Book: The Single Best Recipe from Each Year 1941-2009
992,Travel,2016 Around the World 17 Month Spiral Planner
8737,Travel,Naturhistorische Reise nach der westindischen Insel Haiti (German Edition)
28411,Romance,Push The Button
21826,Travel,Heterogenous Photochemical Electron Transfer
20532,Science & Math,Life's Solution: Inevitable Humans in a Lonely Universe
27258,Science & Math,The Mathematical Theory of Special and General Relativity
36267,Science & Math,Bones: The Life and Times of Harrison Dillard
8994,Travel,St. Vincent and the Grenadines Map
20683,Science & Math,"Plant Taxonomy: Past, present, and future"
1045,Travel,Lonely Planet Swahili Phrasebook & Dictionary
4307,Travel,Through Matabeleland: The record of a ten months' trip in an ox-waggon through Mashonaland and Matabeleland (Rhodesiana reprint library ; v. 33)
4456,Travel,Fodor's Hong Kong: with a Side Trip to Macau (Full-color Travel Guide)
46166,Sports & Outdoors,Weight Training Workouts that Work
5763,Travel,Wild East: Travels in the New Mongolia (Summersdale travel)
8481,Travel,"Dominican Republic/Haiti 1:600 000 Nelles Map (English, French and German Edition)"
35329,Science & Math,The System: The Glory and Scandal of Big-Time College Football
6263,Travel,"Lenin Lives Next Door: Marriage, Martinis, and Mayhem in Moscow"
36626,Sports & Outdoors,"Fearless: One Woman, One Kayak, One Continent"
18488,"Cookbooks, Food & Wine","No Monkeys, No Chocolate"
6513,Travel,Sri Lanka (Guías Azules) (Spanish Edition)
42505,"Cookbooks, Food & Wine",225 Scrumptious Christmas Recipes: A Must-Have Cookbook for Thanksgiving Too!
43394,"Cookbooks, Food & Wine",20 Chinese Recipes for Instant Pot Pressure Cooker
7962,Travel,"Cuba: Its People, Its Society, Its Culture (Survey of World Cultures: No. 10)"
15121,Travel,Reading the Splendid Body: Gender and Consumerism in Eighteenth-Century British Writing on India
13964,Travel,"The Cloud Garden: A True Story of Adventure, Survival, and Extreme Horticulture"
23914,Science & Math,Bayes or Bust?: A Critical Examination of Bayesian Confirmation Theory
17972,Travel,Virginia: Atlas and Gazetteer (Virginia Atlas & Gazeteer)
32876,Sports & Outdoors,Attack the All Court Player DVD (Tennis Magazine's Tactical Tennis)
25404,Travel,Boundless: Tracing Land and Dream in a New Northwest Passage
24061,Science & Math,What Is Time?: The Classic Account of the Nature of Time
23493,Science & Math,Molecular Biology
41399,"Cookbooks, Food & Wine",Pasta Night (Williams-Sonoma)
38512,"Cookbooks, Food & Wine",The Food of Vietnam: Authentic Recipes from the Heart of Indochina
24808,Science & Math,Beginning & Intermediate Algebra (5th Edition)
2384,Travel,Algeria Investment and Business Guide
16478,Travel,Montana's Historical Highway Markers
20161,Travel,Delavier's Stretching Anatomy
44079,"Cookbooks, Food & Wine",The Maine Sporting Camp Cookbook: More Than 400 Favorite Recipes
37588,"Cookbooks, Food & Wine","Chelsea Piers Fitness Solution: Achieve a Lifetime of Health, Weight-Loss and Vitality By Discovering the Activity You Love"
18914,Science & Math,Ogallala Blue: Water and Life on the High Plains
11941,Travel,Treasures of Umbria: Italian Regions
24346,Science & Math,An Imaginary Tale: The Story of [the Square Root of Minus One] (Princeton Science Library)
19410,Science & Math,Asteroid Mining 101: Wealth for the New Space Economy
42359,"Cookbooks, Food & Wine","The Soup Club Cookbook: Feed Your Friends, Feed Your Family, Feed Yourself"
5772,Travel,A Month in Mongolia
11462,Travel,The Rough Guide to Malta & Gozo 1 (Rough Guide Mini Guides)
45208,"Cookbooks, Food & Wine",Fat Fast Cookbook: 50 Easy Recipes to Jump Start Your Low Carb Weight Loss
41103,"Cookbooks, Food & Wine",Dishing Up Maine: 165 Recipes That Capture Authentic Down East Flavors
30958,Romance,Deeply Devoted: A Novel (The Blue Willow Brides) (Volume 1)
34058,Sports & Outdoors,How to Play Bowls (Jarrold Sports Series)
33556,Science & Math,Great Sedona Hikes: Third Edition
31579,Romance,Dare to Desire (Dare to Love) (Volume 2)
12537,Travel,Hidden Cancun and the Yucatan (Hidden Travel)
23940,Science & Math,Handbook of Accelerator Physics and Engineering: 2nd Edition
8498,Travel,Lonely Planet Republica Dominicana y Haiti (Travel Guide) (Spanish Edition)
28639,Travel,The Sins of the Cities of the Plain (Valancourt Classics)
25795,Science & Math,Natural History (Smithsonian)
38455,"Cookbooks, Food & Wine",Cookshelf Thai
8465,Travel,Frommer's EasyGuide to Cuba (Easy Guides)
27157,Science & Math,Heterogeneous Materials I: Linear Transport and Optical Properties (Interdisciplinary Applied Mathematics) (v. 1)
1857,Travel,"Travel + Leisure: 100 Greatest Trips, 8th Edition"
46079,"Cookbooks, Food & Wine","Wolfgang Puck Makes It Healthy: Light, Delicious Recipes and Easy Exercises for a Better Life"
36778,Sports & Outdoors,The Six Skills and Other Discussions: Creative Solutions for Technical Divers
32173,Romance,Jim O'Brien: Bucking the Odds
39519,"Cookbooks, Food & Wine","Iced Tea: 50 Recipes for Refreshing Tisanes, Infusions, Coolers, and Spiked Teas (50 Series)"
39090,"Cookbooks, Food & Wine",Martha Stewart's New Pies and Tarts: 150 Recipes for Old-Fashioned and Modern Favorites
30879,Travel,Good Sam
30700,Romance,The English Son: The Amish Millionaire Part 1
37085,Sports & Outdoors,The Badminton library: golf
22907,Science & Math,Apocalyptic Planet: A Field Guide to the Future of the Earth
33575,"Cookbooks, Food & Wine","Foraging California: Finding, Identifying, And Preparing Edible Wild Foods In California (Foraging Series)"
15963,Travel,Maine New Hampshire & Vermont: A Touring Guide
39447,Travel,The Art of Distilling Whiskey and Other Spirits: An Enthusiast's Guide to the Artisan Distilling of Potent Potables
29374,Romance,Fog: A Novel of Desire and Reprisal
29073,Romance,Secrets Never Die
12325,Travel,La Galleria delle Carte geografiche in Vaticano/The Gallery of Maps in the Vatican
38383,"Cookbooks, Food & Wine",The Best of Vietnamese & Thai Cooking: Favorite Recipes from Lemon Grass Restaurant and Cafes
3821,Travel,Seychelles Travel Guide
4241,Travel,"2008 Country Profile and Guide to Mauritania- National Travel Guidebook and Handbook - Locusts, Famine, AELGA, Arab Maghreb Union, Peace Corps, USAID (Two CD-ROM Set)"
15937,Travel,"The Coast of Maine Book: A Complete Guide, Fifth Edition (A Great Destinations Guide)"
11889,Travel,Umbria (English and Italian Edition)
38487,"Cookbooks, Food & Wine","Vietnamese Food & Cooking: Discover the exotic culture, traditions and ingredients of Vietnamese and Cambodian cuisine with over 150-authentic step-by-step recipes and over 750 photographs"
3639,Travel,"An Oil Geologist Abroad, Bolivia, Spain and Nigeria, 1956-1966"
20845,Science & Math,The Alkaloids: Chemistry and Physiology (Volume IV)
29872,Romance,The American Lady (The Glassblower Trilogy)
12755,Travel,Moon Yucatan Peninsula: Including Chiapas (Moon Handbooks)
5532,Travel,"An der Strasse von Malakka: Ein Botschafter erlebt Singapur, Brunei und Malaysia (German Edition)"
2655,Travel,"The call of the Congo,"
40190,"Cookbooks, Food & Wine",Modernist Cooking Made Easy: Sous Vide: The Authoritative Guide to  Low Temperature Precision Cooking
8547,Travel,Samana: Republica Dominicana / Dominican Republic (Spanish Edition) (Orgullo De Mi Tierra / Pride of My Land)
21518,Science & Math,Molecular Symmetry and Group Theory
38974,"Cookbooks, Food & Wine","Gluten-Free Breakfast, Brunch & Beyond: Breads & Cakes * Muffins & Scones * Pancakes, Waffles & French Toast * Quiches * and More"
754,Travel,Fashion Details: 4000 Drawings
9555,Travel,CHOOSE PANAMA...the PERFECT RETIREMENT HAVEN
23950,Science & Math,"Astronomical Optics, Second Edition"
24257,Science & Math,"Geometry: Seeing, Doing, Understanding, 3rd Edition"
39771,"Cookbooks, Food & Wine",The Official John Wayne Way to Grill: Great Stories & Manly Meals Shared By Duke's Family
1973,Travel,Around the World Resource Guide
34837,Sports & Outdoors,"Strokes of Genius: Federer, Nadal, and the Greatest Match Ever Played"
36597,Sports & Outdoors,"River Rescue: A Manual for Whitewater Safety, 4th Ed."
43682,"Cookbooks, Food & Wine",Biggest Book of Casseroles (Better Homes & Gardens)
25890,Science & Math,Hunger Mountain: A Field Guide to Mind and Landscape
934,Sports & Outdoors,"The RVer's Bible: Everything You Need to Know About Choosing, Using, & Enjoying Your RV"
35753,Romance,Classic Rock Climbs No. 28: Red Rocks: Nevada
16679,Travel,Southern New Hampshire Street Atlas
21758,Science & Math,"Student Study Guide and Solutions Manual for Organic Chemistry, 7th Edition"
2274,Travel,Lonely Planet Madagascar (Travel Guide)
3994,Travel,Deserts: Surviving in the Sahara (X-Treme Places)
16017,Travel,"Mountain Biking the Washington, D.C./Baltimore Area, 4th: An Atlas of Northern Virginia, Maryland, and D.C.'s Greatest Off-Road Bicycle Rides (Regional Mountain Biking Series)"
29198,Romance,Esoterotica's Second Anthology: Enflame
41327,"Cookbooks, Food & Wine",Ruhlman's How to Roast: Foolproof Techniques and Recipes for the Home Cook
27223,Science & Math,A Modern Approach to Quantum Mechanics
28127,Travel,Hopeless
35246,Sports & Outdoors,Grand Prix Motorcycle Racers: The American Heroes
18214,Travel,Jackson Hole Uncovered (Uncovered Series City Guides)
2941,Travel,Atlas du Senegal (Les Atlas Jeune Afrique) (French Edition)
