,Category,Title
9226,Travel,"Explore Costa Rica, 5th Edition"
19823,Science & Math,All About Telescopes
19148,Romance,Saving the Tropical Forests
8464,Travel,Cuba's Best Beaches
35296,Science & Math,Rome 1960: The Summer Olympics That Stirred the World
41800,"Cookbooks, Food & Wine","300 Best Homemade Candy Recipes: Brittles, Caramels, Chocolate, Fudge, Truffles and So Much More"
34693,Sports & Outdoors,"Bikes, Scooters, Skates, and Boards: How to buy 'em, fix 'em, improve 'em & move 'em"
41237,"Cookbooks, Food & Wine","The Pumpkin Pie Spice Cookbook: Delicious Recipes for Sweets, Treats, and Other Autumnal Delights"
12780,Travel,The Desert and the Sown: Travels in Palestine and Syria
24334,Science & Math,"Euler: The Master of Us All (Dolciani Mathematical Expositions, No 22)"
5286,Travel,Kyoto Travel Map Fourth Edition
45469,"Cookbooks, Food & Wine",Olive Trees and Honey: A Treasury of Vegetarian Recipes from Jewish Communities Around the World
3392,Travel,The Caliph's House: A Year in Casablanca
35086,Travel,The Best Of Frank Deford
43891,"Cookbooks, Food & Wine",The Sauce Book: 300 World Sauces Made Simple
8321,Travel,Barbados Country
3688,Travel,The Shadow of Imana: Travels in the Heart of Rwanda
43954,"Cookbooks, Food & Wine","Southern Living Soups, Stews and Chilis: Comfort Food in a Bowl (Southern Living (Paperback Oxmoor))"
8348,Travel,Diving & Snorkeling Guide to Bermuda (Lonely Planet Diving and Snorkeling Bermuda)
23467,Science & Math,Evolutionary Game Theory
42265,"Cookbooks, Food & Wine","Jewish Festivals: Celebrating the Jewish Holidays: Cooking, Crafts, & Traditions"
39410,"Cookbooks, Food & Wine","Cannabis Cocktails, Mocktails, and Tonics: The Art of Spirited Drinks and Buzz-Worthy Libations"
1799,Travel,The Single Girl's Guide to Meeting European Men
8927,Travel,"Puerto Rico 1:190,000 Travel Map 2007"
33129,Science & Math,"How to Know the Grasshoppers, Crickets, Cockroaches and Their Allies"
40541,"Cookbooks, Food & Wine",Culinary Calculations: Simplified Math for Culinary Professionals
841,Travel,Compass American Guides: Yellowstone and Grand Teton National Parks (Full-color Travel Guide)
31495,Romance,Crystal Line (Crystal Singer Trilogy)
24944,Science & Math,Deep Thinking: What Mathematics Can Teach Us About the Mind
24106,Science & Math,"Standard Deviations: Flawed Assumptions, Tortured Data, and Other Ways to Lie with Statistics"
23842,Science & Math,Advanced Mathematical And Computational Tools in Metrology (Series on Advances in Mathematics for Applied Sciences)
22278,Travel,"The Mapmaker's Wife: A True Tale of Love, Murder, and Survival in the Amazon"
34224,Travel,"Codex Wallerstein: A Medieval Fighting Book from the Fifteenth Century on the Longsword, Falchion, Dagger, and Wrestling"
34829,Sports & Outdoors,Playing Zen-Sational Tennis
29692,Romance,The King's Deryni (A Novel of the Deryni)
45836,"Cookbooks, Food & Wine",5:2 Fast Diet for Beginners: 2 Fast Diet for Beginners: The Complete Book for Intermittent Fasting with Easy Recipes and Weight Loss Plans
4010,Travel,Egypt & the Sudan (Lonely Planet Egypt)
312,Travel,"Diving & Snorkeling Baja California:  Includes the Pacific Coast, Sea of Cortez & the Islas De Revillagigedo (Lonely Planet)"
13876,Travel,Chile Handbook (Footprint - Handbooks)
29376,Romance,Midnight Man
3102,Travel,"Lonely Planet South Africa, Lesotho & Swaziland (Travel Guide) by Lonely Planet, Bainbridge, James, Armstrong, Kate, Corne, Lu (2012) Paperback"
8781,Travel,"Traveling Jamaica With Knife, Fork & Spoon: A Righteous Guide to Jamaican Cookery"
14949,Travel,Best Easy Day Hikes Colorado Springs (Best Easy Day Hikes Series)
7739,Travel,Secret Montreal: An Unusual Guide
3744,Travel,The Uganda Travel Journal
19048,"Cookbooks, Food & Wine",5 Acres & A Dream The Book: The Challenges of Establishing a Self-Sufficient Homestead
40047,"Cookbooks, Food & Wine",About Professional Baking
4522,Travel,"Khyber Caravan : Through Kashmir, Waziristan, Afghanistan, Baluchistan and Northern India"
20506,Science & Math,Fossil Shark Teeth of the World
11545,Science & Math,Computational Materials Science: From Ab Initio to Monte Carlo Methods (Springer Series in Solid-State Sciences)
30578,Romance,Secret Sister: An Amish Christmas Tale
3880,Travel,"Somalia Travel Journal, Pop. 10,085,638 + Me"
37076,Travel,The 5 Year Plan of the Soviet Union
10165,Travel,The Rough Guide to Bulgaria 6 (Rough Guide Travel Guides)
2029,Science & Math,Funding for United States Study: A Guide for International Students and Professionals (Funding for Us Study)
10985,Travel,Michelin Hungary Map 732 (Maps/Country (Michelin))
5628,Travel,Mauritius
1558,Travel,Family Guide London (Eyewitness Travel Family Guide)
45874,"Cookbooks, Food & Wine",Gluten-Free Girl: How I Found the Food That Loves Me Back...And How You Can Too
15025,Travel,Family Adventure Guide Connecticut (1st ed.)
23252,Science & Math,The Essential Engineer: Why Science Alone Will Not Solve Our Global Problems
42782,"Cookbooks, Food & Wine",The Bread Machine Bakery Book
33397,"Cookbooks, Food & Wine",Every Shot Must Have a Purpose: How GOLF54 Can Make You a Better Player
987,Travel,Lonely Planet 1000 Ultimate Experiences
198,"Cookbooks, Food & Wine",Cycling Along Europe's Rivers: Bicycle Touring Made Easy and Affordable
21545,Science & Math,Ceramic Materials: Science and Engineering
23615,Science & Math,PE Mechanical Engineering: HVAC and Refrigeration Practice Exam
12543,Travel,CANCUN & COZUMEL POCKET GUIDE (Pocket Guides)
1815,Travel,Free-Wheelin': A Solo Journey Across America
554,Travel,Running Gites and B&Bs in France: The Essential Guide to a Successful Business
13446,Travel,Yemen
13693,Travel,Patagonia: A Hiking Adventure
28207,Romance,The Judges Wife (Volume 1)
10861,Travel,The Rough Guide to Scotland
41241,"Cookbooks, Food & Wine",Spice: Flavors of the Eastern Mediterranean
35483,Sports & Outdoors,Practical Philosophy of Sport and Physical Activity - 2nd Edition
37259,Sports & Outdoors,Squash Rackets (Know the Game)
10206,Travel,Bulgaria (DK Eyewitness Travel Guide)
5953,Travel,Nepal
3849,Travel,"Lonely Planet Mauritius, Reunion & Seychelles (Travel Guide) by Lonely Planet (13-Dec-2013) Paperback"
21355,Science & Math,Principles and Applications of Geochemistry (2nd Edition)
3267,Travel,"Madagascar & Comoros 1:1,200,000 Travel Map, waterproof, GPS-compatible REISE"
30948,Romance,Sophie's Daughters Trilogy
33111,Sports & Outdoors,Freshwater Fishes of New York State: A Field Guide (York State Book)
34072,Science & Math,King of the World (Nova Audio Books)
29833,Romance,Soul Scorched: A Dark Kings Novel
22727,Science & Math,Seismic Wave Propagation and Scattering in the Heterogeneous Earth : Second Edition
38293,"Cookbooks, Food & Wine",Roy's Fish and Seafood: Recipes from the Pacific Rim
15175,Travel,Fox 13 Tampa Bay One Tank Trips With Bill Murphy (Fox 13 One Tank Trips Off the Beaten Path)
34160,Travel,Adventure Cycle-Touring Handbook: Worldwide Route & Planning Guide (Trailblazer)
2146,Travel,"Official Guide to the Smithsonian, 3rd Edition: Third Edition"
13461,Travel,Impressions of Yemen
34821,Sports & Outdoors,Eight Golden Rules for How to Play Your Best Tennis
7324,Travel,Moon New Zealand (Moon Handbooks)
57,Travel,Alaska Birds: A Folding Pocket Guide to Familiar Species (Pocket Naturalist Guide Series)
31710,Romance,"Hit List: An Anita Blake, Vampire Hunter Novel"
13078,Science & Math,The Routledge Historical Atlas of Jerusalem: Fourth edition (Routledge Historical Atlases)
45215,"Cookbooks, Food & Wine",Primal Cravings: Your favorite foods made Paleo
2963,Travel,Esquisses senegalaises (French Edition)
18838,Science & Math,RFID Explained (Synthesis Lectures on Mobile and Pervasive Computing)
35032,Science & Math,"Death, Taxes, and Leaky Waders : A John Gierach Fly-Fishing Treasury"
16224,Travel,Newcomer's Handbook for Moving to and Living in Minneapolis - St. Paul
11472,Travel,"Malta, Gozo : autokarte = Malta, Gozo : road map"
39658,"Cookbooks, Food & Wine",Green Smoothies Diet: The Natural Program for Extraordinary Health
42983,"Cookbooks, Food & Wine","Dutch Oven:  365 Days of Quick & Easy, One Pot, Dutch Oven Recipes"
33077,Travel,"Nature Guide to the Carolina Coast: Common Birds, Crabs, Shells, Fish, and Other Entities of the Coastal Environment"
38884,"Cookbooks, Food & Wine",Miette: Recipes from San Francisco's Most Charming Pastry Shop
1668,Travel,Walt Disney World with Disabilities
6830,Travel,Intimate Outsiders: The Harem in Ottoman and Orientalist Art and Travel Literature (Objects/Histories)
17382,Travel,Pennsylvania (Wild & Scenic)
12233,Travel,"Switzerland: 100 Locals Tell You What to Do, Where to Hike, & How to Fit In"
9383,Travel,Fodor's Belize 2007 (Fodor's Gold Guides)
34733,Sports & Outdoors,Made for Skate: The Illustrated History of Skateboard Footwear
18607,Science & Math,ServSafe Exam Answer Sheet for Pencil/ Paper Exam (stand-alone)
18142,Travel,Wisconsin
2707,Travel,The Napoleonic Survey of Egypt: Description De L'Egypte : The Monuments and Customs of Egypt : Selected Engravings and Texts (Volume 1 & 2)
27758,Travel,Thru: An Appalachian Trail Love Story
27163,Science & Math,Computational Methods in Chemical Engineering with Maple
12336,Travel,The Entity: Five Centuries of Secret Vatican Espionage
44230,"Cookbooks, Food & Wine",The Art of the Restaurateur
42074,"Cookbooks, Food & Wine",Farmhouse Christmas Cookbook (Seasonal Cookbook Collection)
34235,Travel,"Schools and Masters of Fencing: From the Middle Ages to the Eighteenth Century (Dover Military History, Weapons, Armor)"
20867,Science & Math,Chemistry of the Opium Alkaloids; Supplement No. 103 to the Public Health Reports
6430,Travel,Time Out Seoul (Time Out Guides)
36962,Travel,"America's Top Skiing Mountains * Snowboarding in Antarctica * Harrison Barnes * Mads Mikkelsen (Hannibal) * Stephane Peterhansel * January, 2015 The Red Bulletin Magazine"
12561,Travel,DK Eyewitness Top 10 Travel Guide: Cancun & the Yucatan
21124,Science & Math,"Handbook of Affinity Chromatography, Second Edition (Chromatographic Science Series)"
29270,Romance,One Night: Denied (The One Night Trilogy)
44570,"Cookbooks, Food & Wine",Monet's Palate Cookbook: The Artist & His Kitchen Garden At Giverny
9767,Travel,"Travels in the Pyrenees: Including Andorra and the Coast From Barcelona to Carcassonne by O'Connor, Vincent Clarence Scott (2012) Paperback"
10708,Travel,Wallpaper City Guide Oslo 2013
19546,Science & Math,Just Six Numbers: The Deep Forces That Shape The Universe
21639,Science & Math,Molecular Modeling and Simulation: An Interdisciplinary Guide (Interdisciplinary Applied Mathematics)
6080,Travel,Indian Summer: Memsahib in India and Sind
17520,Travel,The Palmetto State Glove Box Guide to Bar-B-Que: The Complete Statewide Guide to Bar-B-Que in South Carolina (Glovebox Guide to Barbecue Series)
21134,Science & Math,"High-Performance Liquid Chromatography of Peptides and Proteins: Separation, Analysis, and Conformation"
8201,Travel,007 Exotic Location; Bahamas
3283,Travel,Africa Central and South and Madagascar
19759,Travel,A Walk through the Heavens: A Guide to Stars and Constellations and their Legends
8968,Travel,"Saint LuciaStreet Map With Index 1:45,000"
39788,"Cookbooks, Food & Wine",Ina's Kitchen: Memories and Recipes from the Breakfast Queen
44098,"Cookbooks, Food & Wine",NOLS Cookery (National Outdoor Leadership School) (NOLS Library)
34211,Sports & Outdoors,The Life-Giving Sword: Secret Teachings from the House of the Shogun
9437,Travel,"Fodor's Honduras & the Bay Islands (Travel Guide) by Fodor's(March 1, 2011) Paperback"
29395,Science & Math,Condor and Falcon
457,Travel,Air Mail Stickers Box (Travel Stickers)
15388,Travel,Camping Idaho (Regional Camping Series)
10498,Travel,Time Out London (Time Out Guides)
3509,Science & Math,"E-Infrastructures and E-Services on Developing Countries: First International ICST Conference, AFRICOM 2009, Maputo, Mozambique, December 3-4, 2009, ... and Telecommunications Engineering)"
20641,Science & Math,New England Wild Flower Society's Flora Novae Angliae: A Manual for the Identification of Native and Naturalized Higher Vascular Plants of New England
22401,Travel,Peterson First Guide to Clouds and Weather
30356,Romance,To Love and to Cherish (Victorian Trilogy)
21618,Science & Math,Selected Solution Manual for Principles of Chemistry: A Molecular Approach
28095,Romance,The Collector
31329,Romance,The Silenced (Krewe of Hunters)
29815,Travel,The Witch of Painted Sorrows (Daughters of La Lune)
23428,Science & Math,The Kelly Capital Growth Investment Criterion: Theory and Practice (World Scientific Handbook in Financial Economics)
37338,Sports & Outdoors,"Winning Table Tennis: Skills, Drills, and Strategies"
39616,"Cookbooks, Food & Wine","Homemade Soda: 200 Recipes for Making & Using Fruit Sodas & Fizzy Juices, Sparkling Waters, Root Beers & Cola Brews, Herbal & Healing Waters, ... & Floats, & Other Carbonated Concoctions"
993,Travel,Beaches: 100 Ultimate Escapes
37981,"Cookbooks, Food & Wine","Stir-Frying to the Sky's Edge: The Ultimate Guide to Mastery, with Authentic Recipes and Stories"
43385,"Cookbooks, Food & Wine",The Ultimate Rice Cooker Cookbook: Delicious Flavors for Today's Easy-to-Use Rice Cookers
25288,Science & Math,Zoopolis: A Political Theory of Animal Rights
25113,Science & Math,Applied Integral Transforms (Crm Monograph Series)
33059,Sports & Outdoors,Fishes of the Sea: The North Atlantic and Mediterranean
11108,Travel,Lost in Iceland
23702,Romance,Scanning Probe Microscopy:  The Lab on a Tip
44558,"Cookbooks, Food & Wine",The Caribbean Pantry Cookbook: Condiments and Seasonings from the Land of Spice and Sun
1696,Travel,"The Red Hat Society Travel Guide: Hitting the Road with Confidence, Class, and Style"
24003,Science & Math,Space and Time in Special Relativity
33705,Travel,In Pursuit of Giant Bass
13860,Travel,Amazon Highlights: Peru · Ecuador · Colombia · Brazil (Bradt Highlights Amazon)
1022,Travel,Weird Arizona: Your Travel Guide to Arizona's Local Legends and Best Kept Secrets
19086,Science & Math,Tropical Grassland Husbandry (Tropical Agriculture Series)
45522,Science & Math,The Art and Science of Low Carbohydrate Living: An Expert Guide to Making the Life-Saving Benefits of Carbohydrate Restriction Sustainable and Enjoyable
5948,Travel,"Everest, the West Ridge"
33029,Travel,Sea of Cortez Marine Animals: A Guide to the Common Fishes and Invertebrates Baja California to Panama
42928,Science & Math,Osmotic Dehydration and Vacuum Impregnation: Applications in Food Industries
35397,Sports & Outdoors,Of Mikes and Men: A Lifetime of Braves Baseball
27218,Science & Math,Introduction to Quantum Mechanics with Applications to Chemistry (Dover Books on Physics)
998,Travel,Spirit of Place: Scotland's Great Whisky Distilleries
21558,Science & Math,A Handbook of Magnetochemical Formulae (Elsevier Insights)
29157,Romance,Dane: Lords of Satyr
15999,Sports & Outdoors,Basic Baltimorese
255,Travel,Paddling Okefenokee National Wildlife Refuge (Regional Paddling Series)
4580,Science & Math,Edge of Time: Traveling in Armenia and Karabagh (Revised Second Edition)
39211,"Cookbooks, Food & Wine",Italian Cooking School: Desserts
15798,Travel,New Orleans Then and Now (Then & Now)
28772,Romance,Justice (Leopard's Spots) (Volume 10)
2938,Travel,Senegal (Africa handbook)
38110,"Cookbooks, Food & Wine",The Chinese Cookbook
7518,Travel,"21st Century Complete Guide to Tonga - Encyclopedic Coverage, Country Profile, History, DOD, State Dept., White House, CIA Factbook (Two CD-ROM Set)"
5941,Romance,Everest: The Unclimbed Ridge (Adrenaline Classics)
37666,Sports & Outdoors,"Sea Kayak Handling: A Practical Manual, Essential Knowledge for Beginner and Intermediate Paddlers"
44441,"Cookbooks, Food & Wine",A Taste of Canada
23803,Science & Math,Measurement Process Qualification: Gage Acceptance and Measurment Uncertainty According to Current Standards
19673,Science & Math,The 50 Most Extreme Places in Our Solar System
39330,"Cookbooks, Food & Wine",The Everything Hard Cider Book: All you need to know about making hard cider at home
14974,Travel,"New London County Street Atlas: Including Colchester, East Lyme, Groton, Ledyard, Montville, New London, North Stonington, Norwich, Stonington, Waterford, and Adjoining Communities"
30830,Romance,Love's Reckoning: A Novel (The Ballantyne Legacy) (Volume 1)
34986,Sports & Outdoors,Basic Aerobatic Manual-87/Rev-90
18403,Science & Math,Agroecology: The Ecology of Sustainable Food Systems
4079,Travel,"Northern Tanzania: Serengeti, Kilimanjaro, Zanzibar"
12906,Travel,Garden of the Brave in War: Recollections of Iran
6065,Sports & Outdoors,Paddling The Frontier (Guide to Pakistan's Whitewater)
23350,Science & Math,Them and Us: How Neanderthal Predation Created Modern Humans
42490,"Cookbooks, Food & Wine",Historical Thanksgiving Cooking and Baking: A Unique Collection of Thanksgiving Recipes from the Time of the Revolutionary and Civil Wars
1842,Travel,Touring California and Nevada Hot Springs (Touring Guides)
2682,Travel,"DEMOCRATIC REPUBLIC OF THE CONGO Country Studies: A brief, comprehensive study of Democratic Republic of the Congo"
34005,Sports & Outdoors,Bowling Execution - 2nd Edition
23390,Science & Math,Game Theory
6058,Science & Math,Oxford School Atlas For Pakistan / New 2010 Edition / Most up-to-date statistics on PAKISTAN and the World / FULL Colour 112 pages / Endorsed By University of Cambridge International Examinations / High quality print
40822,"Cookbooks, Food & Wine",Fix-It and Forget-It Diabetic Cookbook Revised and Updated: 550 Slow Cooker Favorites--To Include Everyone!
38357,"Cookbooks, Food & Wine",The New Cuisine of Hawaii
20960,Science & Math,Forensic Chemistry
30512,Romance,A Step of Faith: A Novel (The Walk)
24023,Science & Math,"Beyond Biocentrism: Rethinking Time, Space, Consciousness, and the Illusion of Death"
44761,"Cookbooks, Food & Wine",The Great Chiles Rellenos Book
21137,Science & Math,"Hplc Of Biological Macro- Molecules, Revised And Expanded (Chromatographic Science)"
44416,"Cookbooks, Food & Wine",The Bread Ovens of Quebec
15161,Travel,"Moon Florida Road Trip: Miami, Fort Lauderdale, Daytona Beach, Walt Disney World, Tampa, Sarasota, Naples, the Everglades & the Keys (Moon Handbooks)"
21139,Travel,The HPLC Solvent Guide
40263,"Cookbooks, Food & Wine",The Life of Cheese: Crafting Food and Value in America (California Studies in Food and Culture)
6025,Travel,The North Korea Travel Journal
17339,Travel,Impressions of Bucks County
2172,Travel,"Finding Birds on the Great Texas Coastal Birding Trail: Houston, Galveston, and the Upper Texas Coast (Gulf Coast Books, sponsored by Texas A&M University-Corpus Christi)"
36366,Science & Math,"Singlehanded Sailing: Thoughts, Tips, Techniques & Tactics"
33630,Travel,"The Good, the Bad, & the Ugly: Philadelphia Flyers: Heart-pounding, Jaw-dropping, and Gut-wrenching Moments from Philadelphia Flyers History (The Good, the Bad, and the Ugly)"
26233,Science & Math,Stability of Dynamical Systems: On the Role of Monotonic and Non-Monotonic Lyapunov Functions (Systems & Control: Foundations & Applications)
35476,Travel,In Pursuit of Excellence - 4th Edition
42069,"Cookbooks, Food & Wine",Best Christmas Nougat and Torrone Candy Recipes: Nougat & Torrone Recipes Sure to Delight
4909,Travel,Culture Shock! Cambodia: A Survival Guide to Customs and Etiquette (Culture Shock! A Survival Guide to Customs & Etiquette)
28522,Romance,Voracious: Erotica for Women
11733,Travel,Road Map Spain & Portugal (Road Map Europe)
25830,Science & Math,Edible and Useful Plants of California (California Natural History Guides)
11223,Travel,The Rough Guide to The Baltic States (Rough Guide Travel Guides)
4016,Travel,Le livre du Soudan (Afrique ancienne) (French Edition)
17959,Travel,"Richmond Castle, Easby Abbey (English Heritage Guidebooks)"
20628,Travel,"Amphibians and Reptiles of Texas: With Keys, Taxonomic Synopses, Bibliography, and Distribution Maps (W. L. Moody Jr. Natural History Series)"
733,Travel,Lonely Planet Pocket Edinburgh (Travel Guide)
31597,Romance,Straddling the Line (A Play-by-Play Novel)
42530,"Cookbooks, Food & Wine","Christmas Sweets and Holiday Treats: 40 Vintage Recipes for Festive Cookies, Confections, and Other Delights"
18485,Science & Math,Banana: The Fate of the Fruit That Changed the World
11103,Science & Math,"Bobby Fischer vs. the Rest of the World: Updated in 2009, with a New Foreword and scores of all 25 games between Fischer and Spassky, with diagrams and some chess analysis by Sam Sloan"
38146,"Cookbooks, Food & Wine",Best Ever Indian Cookbook: 325 Famous Step-By-Step Recipes For The Greatest Spicy And Aromatic Dishes
23521,Science & Math,Planet of the Bugs: Evolution and the Rise of Insects
15346,Travel,Moon Spotlight Boise: Including the Snake River Valley
25350,Science & Math,A Field Guide to the Birds of Brazil
10269,Science & Math,Art and History of Crete (Bonechi Art and History Series)
14596,Travel,"American Map Birmingham, Al Pocket Map"
36723,Sports & Outdoors,White Water Nepal: A Rivers Guidebook for Rafting & Kayaking
25877,"Cookbooks, Food & Wine",The Green Bible
39464,"Cookbooks, Food & Wine",The Best Craft Cocktails & Bartending with Flair: An Incredible Collection of Extraordinary Drinks
40839,"Cookbooks, Food & Wine",Betty Crocker's Slow Cooker Cookbook (Betty Crocker Cooking)
6115,Science & Math,Gazetteer of the Thar and Parkar
41346,"Cookbooks, Food & Wine",The Sneaky Chef: Simple Strategies for Hiding Healthy Foods in Kids' Favorite Meals
3759,Travel,"Sao Tome & Principe (Bradt Travel Guides) by Becker, Kathleen (2014) Paperback"
33956,Sports & Outdoors,Pool Billiard Workout: For Beginners to Intermediate Players (PAT-System Workout)
4581,Travel,Turkish Armenia and Eastern Asia Minor
31460,Romance,Double Star
45494,"Cookbooks, Food & Wine","Quiches, Kugels, and Couscous: My Search for Jewish Cooking in France"
13581,Travel,DK Eyewitness Travel Guide: Chile & Easter Island
46273,"Cookbooks, Food & Wine",Cafe Wisconsin Cookbook
28915,Travel,Putting The Baby In Sitter
36140,Sports & Outdoors,Lacrosse for Fun! (For Fun!: Sports)
4199,Travel,"Algerie Et Tunisie, Esquisse Geographique, (Ed.1885) (Histoire) (French Edition)"
9802,Travel,Fodor's Vienna 25 Best (Full-color Travel Guide)
41962,"Cookbooks, Food & Wine",On a Stick!: 80 Party-Perfect Recipes
45656,"Cookbooks, Food & Wine","The Fat Resistance Diet: Unlock the Secret of the Hormone Leptin to: Eliminate Cravings, Supercharge Your Metabolism, Fight Inflammation, Lose Weight & Reprogram Your Body to Stay Thin-"
9713,Travel,Andorra - Comapedrosa - Engorgs - Juclar - Pessons - Tristaina: ALPI.010
14762,Travel,Grand Canyon: The Story Behind the Scenery
24799,Science & Math,"Fractions, Decimals, & Percents Math Workbook (Includes Repeating Decimals): Improve Your Math Fluency Series"
11588,Travel,Citix60 - Amsterdam: 60 Creatives Show You the Best of the City60 Creatives Show You the Best of the City
32822,Sports & Outdoors,Soccer - Strategies for Sustained Soccer Coaching Success
15831,Travel,Randolph Delehanty's Ultimate Guide to New Orleans
7003,Travel,Sydney PopOut Map (PopOut Maps)
3302,Travel,"MADAGASCAR. Carnet de voyage: Agenda de voyage. Journal de bord pré-imprimé: activités, sport,  shopping, hôtel, transport, road trip. (Carnets de voyage) (French Edition)"
38483,"Cookbooks, Food & Wine",The Vietnamese Cookbook (Capital Lifestyles)
14530,Travel,Lonely Planet California (Travel Guide)
10440,Travel,Copenhagen PopOut Map (PopOut Maps)
35089,Sports & Outdoors,Sports Writing: A Beginner's Guide
17988,Travel,Skid Road: An Informal Portrait of Seattle
32398,Sports & Outdoors,Little League's Official How-to-Play Baseball Book
38689,"Cookbooks, Food & Wine",Dominique Ansel: The Secret Recipes
25280,Travel,Animal Ethics in Context
3786,Travel,Lonely Planet Mauritius Reunion and Seychelles
22283,Travel,The Art of the Map: An Illustrated History of Map Elements and Embellishments
11758,Travel,Pocket Rough Guide Lisbon (Rough Guide Pocket Guides)
40465,"Cookbooks, Food & Wine",Savory Bites: Meals You can Make in Your Cupcake Pan
27453,Science & Math,Local And Global Analysis of Nonlinear Dispersive And Wave Equations (CBMS Regional Conference Series in Mathematics)
21308,Travel,"X-Ray Structure Determination: A Practical Guide, 2nd Edition"
42272,"Cookbooks, Food & Wine",Kosher USA: How Coke Became Kosher and Other Tales of Modern Food (Arts and Traditions of the Table: Perspectives on Culinary History)
18076,Travel,"The Blackwater Chronicle: A Narrative of an Expedition into the Land of Canaan in Randolph County, Virginia (West Virginia and Appalachia Series, 2) (WEST VIRGINIA & APPALACHIA)"
6482,Travel,The Teardrop Island: Following Victorian Footsteps Across Sri Lanka
11266,Travel,"Estonia, Latvia and Lithuania (World Travel)"
38874,"Cookbooks, Food & Wine",Julia M. Usher's Ultimate Cookies
27239,Sports & Outdoors,Summoning Spirits: The Art of Magical Evocation (Llewellyn's Practical Magick)
17955,Travel,Virginia State Road Atlas
22325,Science & Math,Social Cartography: Mapping Ways of Seeing Social and Educational Change (Garland Reference Library of Social Science)
17361,Travel,Philadelphia & Mid-Atlantic States 1:10K/1:1M ITM Travel Map
9326,Travel,Guatemala Pacific Slope Birds Wildlife Guide (Laminated Foldout Pocket Field Guide)
26411,Science & Math,Modern Technical Physics (6th Edition)
14231,Travel,"Cusco, Peru Tourist Map"
3048,Travel,Journey Through Kenya (Journey Through...)
38332,Travel,Rockpool
38087,"Cookbooks, Food & Wine","The Chinese Vegan Kitchen: More Than 225 Meat-free, Egg-free, Dairy-free Dishes from the Culinary Regions o f China"
39978,"Cookbooks, Food & Wine",Toro Bravo: Stories. Recipes. No Bull.
46333,"Cookbooks, Food & Wine",The Culinary Lives of John & Abigail Adams: A Cookbook
23900,Science & Math,Photoelectron Spectroscopy
