,Category,Title
4920,Travel,Insight Guides: Taipei City Guide (Insight City Guides)
24431,Science & Math,Asymptotic Expansions (Dover Books on Mathematics)
15405,Science & Math,Josiah Gregg and Lewis H. Garrard (Boise State University Western Writers Series)
2792,Travel,CIAO ASMARA. A Classic Account of Contemporary Africa.
34262,Sports & Outdoors,"Foil, Saber, and ÁEpée Fencing: Skills, Safety, Operations, and Responsibilities"
23561,Science & Math,Global Brain: The Evolution of Mass Mind from the Big Bang to the 21st Century
27552,Science & Math,Teaching Physics
41435,"Cookbooks, Food & Wine","Cucina Fresca: Italian Food, Simply Prepared"
34309,Sports & Outdoors,The Gymnast Care Book on Injuries: At home and in the gym treatment of the most common gymnastics injuries
6822,Travel,"Yes, I Would...: An American Woman's Letters to Turkey"
22784,Science & Math,"Applied Biophysics of Activated Water: The Physical Properties, Biological Effects and Medical Applications of MRET Activated Water"
33569,Science & Math,Walking with Spring
33335,Sports & Outdoors,Lake Michigan Rock Picker's Guide
21068,Science & Math,Gas Chromatography: Analytical Chemistry by Open Learning
2163,Travel,Best Hikes With Dogs: San Francisco Bay Area and Beyond
28282,Romance,Strap On Sex Stories And Femdom Tales: XXX Strap On Dildo Erotica Sex Stories
906,Travel,"""Yet there isn't a train I wouldn't take"": Railway Journeys by William D. Middleton (Railroads Past and Present)"
17260,Travel,Atlas of Oregon
42953,"Cookbooks, Food & Wine","The Ultimate Guide To Food Dehydration and Drying: How To Dehydrate, Dry, and Preserve Your Food"
15886,Travel,Islands of the Mid-Maine Coast: Muscongus Bay and Monhegan Island
3990,Travel,"La vuelta al mundo en 10 años: Por el mal camino: Sudán, Etiopía, Kenia. (Spanish Edition)"
14255,Travel,Eight Feet in the Andes: Travels with a Mule in Unknown Peru
22873,Science & Math,"Mine Planning and Equipment Selection: Proceedings of the 22nd MPES Conference, Dresden, Germany, 14th - 19th October 2013"
29454,Romance,The Pussy Trap 3: Death by Temptation
20159,Travel,Follow Your Gut: The Enormous Impact of Tiny Microbes (TED Books)
17229,Travel,"Frommer's EasyGuide to Seattle, Portland and the Oregon Coast (Easy Guides)"
14275,Travel,The Enigma Of Tiwanaku And Puma Punku: A Visitor's Guide
46429,"Cookbooks, Food & Wine",What Real Alaskans Eat: Not Your Ordinary Cookbook
21555,Science & Math,Lanthanide and Actinide Chemistry
44986,"Cookbooks, Food & Wine","Make-Ahead Paleo: Healthy Gluten-, Grain- & Dairy-Free Recipes Ready When & Where You Are"
23559,Travel,A Fish Caught in Time: The Search for the Coelacanth
10488,Travel,Kids travel journal: my trip to copenhagen
34022,Travel,Milwaukee's Historic Bowling Alleys (Images of America) (Images of America Series)
29141,Romance,Wolf Tales 11
41895,"Cookbooks, Food & Wine",Dip Into Something Different: A Collection of Recipes from Our Fondue Pot to Yours
31238,Romance,The Other Game: A Dean Carter Novel
18798,Romance,The Brown Recluse Spider
8008,Travel,Adventure Guide Leeward Islands (Adventure Guides Series) (Hunter Travel Guides)
22276,Science & Math,"Thematic Cartography and Geovisualization, 3rd Edition"
20016,Science & Math,Vagina: Revised and Updated
33157,Science & Math,"A field guide to the insects of America north of Mexico, (The Peterson field guide series, 19)"
1102,Travel,Nahuatl-English English-Nahuatl Concise Dictionary (Hippocrene Concise Dictionary)
5880,Travel,Let's Visit Burma (Burke Books)
40470,"Cookbooks, Food & Wine",Make Ahead Meals: Over 100 Easy Time-Saving Recipes
5672,Travel,Bradt Mauritius
37245,Sports & Outdoors,Squash Rackets
16193,"Cookbooks, Food & Wine",More Natural Michigan
13297,Travel,"Arab Gulf States: Bahrain, Kuwait, Oman, Qatar, Saudi Arabia & the United Arab Emirates (Lonely Planet Travel Survival Kit)"
30301,Romance,"Captured by a Laird: The Douglas Legacy, Book 1"
46616,"Cookbooks, Food & Wine",Western National Parks' Lodges Cookbook
11522,Travel,Baedeker's Malta (AA Baedeker's)
24658,Science & Math,Computational Inelasticity (Interdisciplinary Applied Mathematics) (v. 7)
39098,"Cookbooks, Food & Wine",Pie: 300 Tried-and-True Recipes for Delicious Homemade Pie
27219,Science & Math,"The Feynman Lectures on Physics, Vol. III: The New Millennium Edition: Quantum Mechanics (Volume 3)"
5799,Travel,The Rough Guide to Myanmar (Burma)
36928,Sports & Outdoors,Snowboarding (Action Sports (Abdo))
1425,Travel,The Business Travel Handbook
13653,Travel,"Fodor's Buenos Aires: with Side Trips to Iguazú Falls, Gaucho Country & Uruguay (Full-color Travel Guide)"
23990,Travel,manos que curan el libro guia de las curaciones 34ed
30250,Travel,Almost Heaven
20259,Science & Math,"Bioelectrochemistry I: Biological Redox Reactions (Emotions, Personality, and Psychotherapy) (No. 1)"
17679,Travel,"Rand McNally Houston regional map, Texas"
20426,Sports & Outdoors,Strategies for Teaching Strings: Building a Successful String and Orchestra Program
46364,"Cookbooks, Food & Wine",Celebrate The Rain: Cooking With The Fresh And Abundant Flavors Of The Pacific Northwest
33222,Science & Math,The Snouters: Form and Life of the Rhinogrades (A Phoenix book)
4624,Travel,"Narrative of the Embassy of Ruy González de Clavijo to the Court of Timour, at Samarcand, A.D. 1403-6"
8389,Travel,Bermuda
34064,Travel,A Handy Illustrated Guide to Bowling and Duck Pins
25852,Science & Math,The Secret Life of Lobsters: How Fishermen and Scientists Are Unraveling the Mysteries of Our Favorite Crustacean (P.S.)
23206,Science & Math,Beyond the War on Invasive Species: A Permaculture Approach to Ecosystem Restoration
6307,Travel,Diary of an Expat in Singapore
30904,Romance,Love's Long Journey (Love Comes Softly Series #3) (Volume 3)
4575,Travel,"Clash of Histories in the South Caucasus: Redrawing the Map of Azerbaijan, Armenia and Iran"
3661,Travel,AFRICA Geographic - August 2003 - Ngorongoro - Niger - Namaqualand - Maasai - Zambia - Kafue - Cats - Wildlife - Nature - Conservation - People - Travel -
41661,Travel,"Whole Grains Every Day, Every Way"
2970,Travel,"Gambia (Bradt Travel Guides) by Emms, Craig, Barnett, Linda (2006) Paperback"
25970,Science & Math,"Basic Environmental Technology: Water Supply, Waste Management and Pollution Control (6th Edition)"
14351,Travel,"Destination Nature le Venezuela: Les Attractions Touristiques Naturelles du Venezuela Comprennent la Gran Sabana, la Plaine Herbeuse de Llanos, la ... la Flore (Calvendo Nature) (French Edition)"
1996,Travel,"The Study Abroad Truth: You Might Just Discover Yourself, What You Need to Know Before, During, and After Your Journey! 2nd Edition"
6924,Science & Math,"Speak Like a Thai, Vol. 2: Thai Slang and Idioms"
13253,Travel,Zawarib Beirut & Beyond: Road Atlas of Greater Beirut Plus 75 Municipalities from Tabarja to Choueifat
11151,Travel,"3 Day Guide to Dublin: A 72-hour Definitive Guide on What to See, Eat and Enjoy in Dublin, Ireland (3 Day Travel Guides) (Volume 11)"
34442,Sports & Outdoors,The Joy of Juggling
30458,Science & Math,Lord of Fire and Ice
10697,Travel,A Stockholm Interlude: A Guide to the Usual & Unusual
34454,Science & Math,Manual of Juggling (Facsimile Reprint)
38693,"Cookbooks, Food & Wine",Mug Cakes: 100 Speedy Microwave Treats to Satisfy Your Sweet Tooth
31023,Travel,96 Hours
41323,"Cookbooks, Food & Wine",101 Things to Do with Bacon
35760,Travel,Matterhorn: The Quintessential Mountain
26547,Science & Math,"Entropy, Compactness and the Approximation of Operators (Cambridge Tracts in Mathematics)"
46489,"Cookbooks, Food & Wine",New Soul Cooking: Updating a Cuisine Rich in Flavor and Tradition
13772,Travel,"Let's Go 2003: Peru, Ecuador & Bolivia"
40981,"Cookbooks, Food & Wine","The Cheese Lover's Companion: The Ultimate A-to-Z Cheese Guide with More Than 1,000 Listings for Cheeses and Cheese-Related Terms"
12477,Travel,"Pocket Acapulco: Including Taxco, Ixtapa and Zihuatanejo (Fodor's in Focus Acapulco)"
46205,Travel,Seasons of a Finger Lakes Winery
31409,Romance,"Seven Up (Stephanie Plum, No. 7) (Stephanie Plum Novels)"
36695,Travel,"The Explorer's Guide to the Youghiogheny River Gorge / Ohiopyle, & S.W. Pennsylvania's Villages"
39620,"Cookbooks, Food & Wine","The Healthy Juicer's Bible: Lose Weight, Detoxify, Fight Disease, and Live Long"
11021,Travel,"Budapest City Journal, City Notebook for Budapest, Hungary"
12732,Travel,Yucatan Peninsula
45700,"Cookbooks, Food & Wine",Meniere Man In The Kitchen: Recipes That Helped Me Get Over Meniere's
41140,"Cookbooks, Food & Wine",The Sobo Cookbook: Recipes from the Tofino Restaurant at the End of the Canadian Road
1853,Travel,"Taking the Waters in Texas: Springs, Spas, and Fountains of Youth"
26996,Science & Math,Creep and Relaxation of Nonlinear Viscoelastic Materials (Dover Civil and Mechanical Engineering)
24580,Science & Math,Optimization Algorithms on Matrix Manifolds
4399,Travel,"2006 Country Profile and Guide to Zimbabwe:  National Travel Guidebook and Handbook:  Human Rights and Sanctions, USAID Reports, Water Use, Law, Energy, AGOA (Two CD-ROM Set)"
3290,Travel,Atlas de la peste ÁE  Madagascar (French Edition)
42031,"Cookbooks, Food & Wine",Christmas Joy : A Keepsake Book from the Heart of the Home
22412,Science & Math,Climate Change 2013 - The Physical Science Basis: Working Group I Contribution to the Fifth Assessment Report of the Intergovernmental Panel on Climate Change
14027,Travel,"Ecuador Galapagos FB 1:800 000 2012 (English, Spanish, French, Italian and German Edition)"
8914,Travel,Report on the Island and Diocese of Puerto Rico (1647) (Ecos)
17308,Romance,Love: A Philadelphia Affair
28611,Romance,Elfin Blood
37672,Sports & Outdoors,Complete Book of Sea Kayaking (How to Paddle Series)
8232,Travel,"Nassau, Island of New Providence, Bahamas: A Guide to the Sanitarium of the Western Hemisphere, Its Attractions, and How to Get There (Classic Reprint)"
4400,Travel,"Lonely Planet Zimbabwe, Botswana and Namibia (2nd ed)"
3970,Travel,Sudan & South Sudan Geographical
7377,Romance,Encounters With the Dani
11642,Travel,Jessica Backhaus: Jesus and the Cherries (German Edition)
19302,Sports & Outdoors,The Reasons for Seasons
37223,Sports & Outdoors,Paddleball and racquetball (Goodyear physical activities series)
16959,Travel,Not For Tourists Guide to Brooklyn 2015
33403,Sports & Outdoors,Putting Out of Your Mind
45000,"Cookbooks, Food & Wine",Paleo Comfort Foods: Homestyle Cooking for a Gluten-Free Kitchen
10405,"Cookbooks, Food & Wine",Mikkeller's Book of Beer: Includes 25 Original Mikkeller Brewing Recipes
45637,"Cookbooks, Food & Wine","Kristen Suzanne's ULTIMATE Raw Vegan Chocolate Recipes: Fast & Easy, Sweet & Savory Raw Chocolate Recipes Using Raw Chocolate Powder, Raw Cacao Nibs, and Raw Cacao Butter"
2993,Travel,SAFARI: My Trip to Africa
18380,Travel,The Fear Babe: Shattering Vani Hari's Glass House
11664,Travel,The Jews of Poland: A Social and Economic History of the Jewish Community in Poland from 1100 to 1800
44205,"Cookbooks, Food & Wine","No Apologies Gluten-Free: Tailgates, Potlucks, Picnics & More"
11921,Travel,Authentic Umbria: Perugia - Assisi - Gubbio - Spoleto - Todi - Orvieto - Trasimeno Lake (Authentic Italy)
18218,Travel,Scenic Routes & Byways Yellowstone & Grand Teton National Parks
10835,Travel,DK Eyewitness Travel Guide: Hamburg
44445,Science & Math,"Play: How it Shapes the Brain, Opens the Imagination, and Invigorates the Soul by Stuart Brown M.D. (April 6 2010)"
8072,Travel,Franko's Guide map of Bonaire
25047,Science & Math,320 SAT Math Problems arranged by Topic and Difficulty Level
41630,"Cookbooks, Food & Wine",Good Housekeeping 400 Calorie Chicken: Easy Mix-and-Match Recipes for a Skinnier You! (Good Housekeeping Cookbooks)
23455,Science & Math,Chases and Escapes: The Mathematics of Pursuit and Evasion (Princeton Puzzlers)
40107,"Cookbooks, Food & Wine",Bourbon: a Savor the South® cookbook (Savor the South Cookbooks)
32864,Sports & Outdoors,Play Winning Tennis with Perfect Fundamentals
34284,Sports & Outdoors,A Dictionary of Universally Used Fencing Terminology
16034,Travel,"Philadelphia, Wilmington and Baltimore Railroad Guide: Containing a Description of the Scenery, Rivers, Towns, Villages, and Objects of Interest Along ... Including Historical Sketches, Legends, &c."
1688,Travel,Ready-to-Use Travel and Tourist Illustrations (Dover Clip Art Ready-to-Use)
45649,"Cookbooks, Food & Wine","The Starch Solution: Eat the Foods You Love, Regain Your Health, and Lose the Weight for Good!"
29848,"Cookbooks, Food & Wine","Kiss of Midnight (The Midnight Breed, Book 1)"
45867,"Cookbooks, Food & Wine",The Harcombe Diet Lunch Box Recipes
44417,"Cookbooks, Food & Wine",Aunt Maud's Recipe Book: From the Kitchen of L.M. Montgomery
30442,Romance,The Very Virile Viking (Viking II)
31740,Romance,Stone Cold Cowboy: A Montana Men Novel
16042,Travel,Chesapeake Country
30679,Romance,The Brides Of Lancaster County
9139,Travel,Honduras Handbook (Footprint - Handbooks)
12533,Sports & Outdoors,Cozumel Survival Manual
44534,"Cookbooks, Food & Wine",The Rasta Cookbook: Vegetarian Cuisine
4590,Travel,"Travels in Georgia, Persia, Armenia, ancient Babylonia, &c. &c Volume 2; during the years 1817, 1818, 1819, and 1820"
5429,Travel,"Food, travel and shopping in Macau (Chinese Edition)"
40575,"Cookbooks, Food & Wine","Microwave Cookbook: 40 Delicious, Healthy and Easy to Make Meal Recipes for Busy People (Quick and Easy Microwave Meal Recipes)"
11441,Travel,Belgium and Luxembourg Insight Travel Map
45564,"Cookbooks, Food & Wine",Ketogenic Diet: 50 Delicious Ketogenic Recipes And The Complete Guide To Going Ketogenic
34459,Sports & Outdoors,Juggling (Creative kids)
44622,"Cookbooks, Food & Wine",Curbside: Modern Street Food from a Vagabond Chef
10345,Travel,"Prague: 10 Locals Tell You Where to Go, What to Eat, & How to Fit In"
17013,Travel,Short Bike Rides in North Carolina (Short Bike Rides Series)
16027,Travel,"Howard County, Maryland Street Map Book"
14834,Travel,Historic San Francisco: A Concise History and Guide
16875,Travel,Georgia O'Keeffe Museum
24268,Science & Math,Introduction to Tensor Analysis and the Calculus of Moving Surfaces
44495,"Cookbooks, Food & Wine",Mamá Pura's recipes: English Black & White Edition (Dominican Traditional Recipes)
39103,"Cookbooks, Food & Wine","Southern Pies: A Gracious Plenty of Pie Recipes, From Lemon Chess to Chocolate Pecan"
40602,"Cookbooks, Food & Wine",Campbells Microwave Cookbook
30286,Romance,To Scotland with Love: A Kilts and Quilts Novel
31094,Romance,Hard to Hold On To: A Hard Ink Novella
25992,Science & Math,"Reverse Osmosis: Design, Processes, and Applications for Engineers"
25006,Science & Math,Applied Data Analytic Techniques For Turning Points Research (Multivariate Applications Series)
8394,Travel,"Bermuda, a colony, a fortress, and a prison; or, Eighteen months in the Somers' Islands. With map and illustrations. By a Field Officer i.e. Ferdinand Whittingham"
13007,Romance,A reed shaken by the wind
29935,Travel,Twice in a Lifetime
4272,Travel,Travel Journal: My Trip to Mali
33270,Travel,Mac's Field Guide to Land Mammals of North America (Laminated Card)
13817,Travel,"Conversational Portuguese Quick and Easy: The Most Innovative Technique to Learn the Brazilian Portuguese Language. For Beginners, Intermediate, and Advanced Speakers"
38329,"Cookbooks, Food & Wine",Hawaii's Favorite Bento Box Recipes: Lots of Fun Lunches for Kids
29260,Romance,Sweet Addiction
24110,Science & Math,Propensity Score Analysis: Fundamentals and Developments
44674,"Cookbooks, Food & Wine",Delicious El Salvador: 75 Authentic Recipes for Traditional Salvadoran Cooking
9668,Travel,Lonely Planet Belgium & Luxembourg (Travel Guide)
5826,Science & Math,Bagan and Upper Myanmar
33722,Travel,"Colorado's Best Fly Fishing: Flies, Access, and Guide's Advice for the State's Premier Rivers (Headwater Guides)"
7796,Travel,Gros Morne National Park
26773,Science & Math,"OLED Fundamentals: Materials, Devices, and Processing of Organic Light-Emitting Diodes"
10587,Travel,Mission Estonia
46549,"Cookbooks, Food & Wine",Cooking with Cafe Pasqual's: Recipes from Santa Fe's Renowned Corner Cafe
8027,Travel,"Antigua & Barbuda Travel Journal, Pop. 89,018 + Me"
5597,Travel,Maldives Insight Fleximap (Insight Flexi Maps)
14203,Travel,"Argentina North and Uruguay Map by Nelles (Nelles Maps) (English, French and German Edition)"
32086,Sports & Outdoors,Five-Star Basketball Coaches' Playbook 2
45397,"Cookbooks, Food & Wine","Coconut Flour Recipes: Gluten Free, Low-carb and Low GI Alternative to Wheat: High in Fiber and Protein"
46167,"Cookbooks, Food & Wine",As American as Shoofly Pie: The Foodlore and Fakelore of Pennsylvania Dutch Cuisine
3847,Travel,"Lonely Planet Mauritius Reunion & Seychelles (Multi Country Travel Guide) by Jean-Bernard Carillet, Brandon Presser (2010) Paperback"
35285,Sports & Outdoors,The Olympic Games Effect: How Sports Marketing Builds Strong Brands
41550,"Cookbooks, Food & Wine",Irish Potato Cookbook
23708,Science & Math,Sample Preparation Handbook for Transmission Electron Microscopy: Methodology
23457,Science & Math,Game-Changer: Game Theory and the Art of Transforming Strategic Situations
40699,Science & Math,The Kitchen as Laboratory: Reflections on the Science of Food and Cooking (Arts and Traditions of the Table: Perspectives on Culinary History)
18473,Sports & Outdoors,The Chicken Encyclopedia: An Illustrated Reference
20180,Science & Math,"Zipping, Zapping, Zooming Bats (Let's-Read-and-Find-Out Science 2)"
41911,"Cookbooks, Food & Wine",The Seasonal Jewish Kitchen: A Fresh Take on Tradition
44385,"Cookbooks, Food & Wine","Fan Fare! Best of Bridge Cookbook: Brand-New Volume, Brand-New Recipes (The Best of Bridge)"
8194,Travel,"Spanish Wells Bahamas: The Island, The People, The Allure"
45671,"Cookbooks, Food & Wine","Bobby Deen's Everyday Eats: 120 All-New Recipes, All Under 350 Calories, All Under 30 Minutes"
22221,Science & Math,The Ship and the Storm
27750,Travel,Mechanical Failure
31389,Romance,It's a Wonderful Wife (Sinclair Brothers Novel)
20288,Science & Math,What Mad Pursuit: A Personal View of Scientific Discovery
42424,"Cookbooks, Food & Wine",More Home Cooking: A Writer Returns to the Kitchen
20509,Science & Math,"""T. rex"" and the Crater of Doom (Princeton Science Library)"
22800,Romance,Rainfall-Runoff Modelling: The Primer
7002,Travel,Frommer's EasyGuide to Australia 2016 (Easy Guides)
17026,Travel,"Insiders' Guide® to North Carolina's Southern Coast and Wilmington, 17th (Insider's Guide to North Carolina's Southern Coast & Wilmington)"
16877,Travel,Albuquerque Street Map (Rand Mcnally)
8059,Travel,The Complete Diving Guide to Antigua (Complete Diving Guides Book 1)
13776,Travel,"Green hell;: Adventures in the mysterious jungles of eastern Bolivia,"
37296,Sports & Outdoors,Racquet Sports (Fair Play)
31745,"Cookbooks, Food & Wine",Dylan's Redemption: Book Three: The McBrides
6197,Romance,Philippine Homecoming's Cherished Memories
19874,Science & Math,"Advanced Telescope Design, Fabrication and Control (Spie Proceedings Series,)"
32020,Sports & Outdoors,A Game Plan for Life: The Power of Mentoring
461,Travel,Art of Flying: The Golden Decades of Private Air Travel
42562,"Cookbooks, Food & Wine",Weeknights with Giada: Quick and Simple Recipes to Revamp Dinner
9840,Travel,"Vienna & Bratislava Travel Guide: Attractions, Eating, Drinking, Shopping & Places To Stay"
19800,Science & Math,NightWatch: A Practical Guide to Viewing the Universe
25851,Science & Math,"Environmental Science Activities Kit: Ready-to-Use Lessons, Labs, and Worksheets for Grades 7-12"
36479,Travel,"AMC Discover Cape Cod: AMC's Guide To The Best Hiking, Biking, And Paddling (Appalachian Mountain Club: Discover Cape Cod)"
15481,Science & Math,Chicago For Dummies
2190,Travel,Unexpected Indiana: A Portfolio of Natural Landscapes (Quarry Books)
23329,Travel,The Hound of the Baskervilles (Hardcover Classics)
38080,"Cookbooks, Food & Wine",Chinese Cooking For Dummies
20499,Travel,"The Complete Book of Dinosaurs: The ultimate reference to 355 dinosaurs from the Triassic, Jurassic and Cretaceous periods, including more than 900 illustrations, maps, timelines and photographs"
45010,"Cookbooks, Food & Wine",Gluten-Free Bible
46517,"Cookbooks, Food & Wine",Cooking Up a Storm: Recipes Lost and Found from The Times-Picayune of New Orleans
5479,Travel,"The Rough Guide to Malaysia, Singapore  &  Brunei 5 (Rough Guide Travel Guides)"
41849,"Cookbooks, Food & Wine","Drink Smarter! Beverages: 101 delicious, health-boosting, sugar-free lattes, teas, hot chocolates, frozen drinks, yogurt drinks, sodas, mocktails, and infused waters"
14648,Travel,Alaska Blues: A Season of Fishing the Inside Passage
40987,"Cookbooks, Food & Wine",Scoop Adventures: The Best Ice Cream of the 50 States: Make the Real Recipes from the Greatest Ice Cream Parlors in the Country
45144,"Cookbooks, Food & Wine","Anti-Breast Cancer Cookbook: How to Cut Your Risk with the Most Powerful, Cancer-Fighting Foods"
18266,Travel,Washington D.C. (Insight Guide Washington DC)
21786,Science & Math,Organic Chemistry
19562,Science & Math,"Not a Chance: God, Science, and the Revolt against Reason"
30780,Travel,The Headmistress of Rosemere (Whispers On The Moors)
41152,"Cookbooks, Food & Wine","People's Pops: 55 Recipes for Ice Pops, Shave Ice, and Boozy Pops from Brooklyn's Coolest Pop Shop"
36457,Sports & Outdoors,"Sea Kayaking: The Classic Manual for Touring, from Day Trips to Major Expeditions"
44931,"Cookbooks, Food & Wine",Deep South Dish: Homestyle Southern Recipes (Best of the Best Presents)
16222,Travel,Twin Cities Restaurant Guide: 120 Fabulous Dining Choices by Minnesota's Premier Food Writer (Trails Books Guide)
38758,"Cookbooks, Food & Wine",Callie's Biscuits and Southern Traditions: Heirloom Recipes from Our Family Kitchen
13512,Travel,Doctor Who And The Tenth Planet (Doctor Who (BBC))
46297,"Cookbooks, Food & Wine",Bistro Cooking at Home
5667,Travel,Mauritius North: Bilduma Souvenir bat argazki koloretan epigrafeekin (Argazki Albumak) (Volume 11) (Basa Edition)
7838,Travel,Killarney
3553,Travel,Namibia Travel Pack (Globetrotter Travel Packs)
20752,Science & Math,Chemistry: The Central Science (13th Edition)
9501,Travel,Footprint Nicaragua Handbook
16038,Travel,"Never Easy, Never Pretty: A Fan, A City, A Championship Season"
41161,"Cookbooks, Food & Wine","Edible Party Bouquets: Creating Gifts and Centerpieces with Fruit, Appetizers, and Desserts"
16832,Travel,New Jersey Puzzle Book (Which Way USA?)
27117,Science & Math,"High-Quality Visual Experience: Creation, Processing and Interactivity of High-Resolution and High-Dimensional Video Signals (Signals and Communication Technology)"
919,Travel,"Underground Railroad in Delaware, Maryland, and West Virginia (The Underground Railroad)"
16572,Travel,Nebraska Historical Tour Guide (A [Cross]roads book)
11901,Travel,"Made in Tuscany & Umbria: A Travel Guide to Maiolica Ceramics, Marble, Stone, Alabaster, Terracotta, Leather, Woodcrafts & More (Laura Morelli's Authentic Arts)"
31842,Travel,Practical Guide to Persian Alphabet
19319,Science & Math,Developing Safety-Critical Software: A Practical Guide for Aviation Software and DO-178C Compliance
22494,Science & Math,The Earthquake Observers: Disaster Science from Lisbon to Richter
46574,Travel,Austin Beer:: Capital City History on Tap (American Palate)
41025,Travel,Fine Chocolates Great Experience 3: Extending Shelf Life
22400,Science & Math,"An Introduction to Dynamic Meteorology, Volume 88, Fifth Edition (International Geophysics)"
7719,Romance,The Canadian Rockies
291,Travel,Dive the Cayman Islands (Interlink Dive Guide)
9955,Travel,"Streetwise Brussels Map - Laminated City Center Street Map of Brussels, Belgium (Streetwise (Streetwise Maps))"
32667,Sports & Outdoors,Hockey Goaltending
31122,Romance,Targeted: A Deadly Ops Novel (Deadly Ops Series)
17279,Travel,Best Hikes Near Portland (Best Hikes Near Series)
7649,Travel,"In the New Hebrides;: Reminiscences of missionary life and work, especially on the island of Aneityum, from 1850 till 1877"
29564,Romance,"The Brothers of Wilde, Nevada, Volume 1 [Going Wilde: Wilde Fire] (Siren Publishing Lovextreme Forever)"
41835,"Cookbooks, Food & Wine",Frozen Desserts
38202,"Cookbooks, Food & Wine",Pure and Simple: Homemade Indian Vegetarian Cuisine
8566,Travel,Martinique Domtom 2014: IGN84972
18129,Travel,Eau Claire WI Street Map (American Map)
75,Travel,Miami Birds: A Folding Pocket Guide to Familiar Species (Pocket Naturalist Guide Series)
9328,Travel,"Halfway to heaven,: A Guatemala holiday"
31583,Travel,Scoring Wilder
37354,Sports & Outdoors,"Ping-Pong: The Game, Its Tactics and Laws (Reprint)"
557,Travel,Special Places to Stay Greece
12219,Travel,"Spanish for Children with Three Audio CDs, Third Edition"
40451,"Cookbooks, Food & Wine",The Crimson Spoon: Plating Regional Cuisine on the Palouse
31810,Romance,Romance Writer's Phrase Book (Perigee Book)
12499,Travel,"AAA Mexico: Including Acapulco, Campeche, Chihuahua, Guadalajara, Hermosillo, Monterrey, San Luis Potosi, Veracruz, Plus Mexico City and Vicinity Map, Downtown Mexico City Map, Mexico Driving Distance Chart: AAA International Series 2008 (1206308527307, 1206308495)"
44567,"Cookbooks, Food & Wine",Bistronomy: Recipes from the Best New Paris Bistros
23240,Science & Math,"Lies, Damned Lies, and Science: How to Sort Through the Noise Around Global Warming, the Latest Health Claims, and Other Scientific Controversies (FT Press Science)"
21353,Science & Math,Groundwater Geochemistry and Isotopes
23026,Travel,Origin of Carbonate Sedimentary Rocks (Wiley Works)
24560,Science & Math,Introduction to Quadratic Forms (Classics in Mathematics)
18472,Travel,"Four Paws, Five Directions: A Guide to Chinese Medicine for Cats and Dogs"
30659,Romance,The Love Letters
16045,Travel,"ASC The Map People Frederick County, Maryland: Street Atlas"
37737,Travel,Swimming Studies
