,Category,Title
13668,Travel,Nowhere Is a Place Travels in Patagonia a Sierra Club Book (Hardback)
8492,Travel,A Wedding in Haiti
16732,Travel,Metacomet-Monadnock Trail Guide: A Trail Guide with Maps of the 117 Mile Long Distance Foot Path Through the 3 County-Pioneer Valley Region of Western ... & the Monadnock Region of S. W. New Hampshire
34415,Sports & Outdoors,Karate-Do Tradicional II - Ejec. del Kata (Spanish Edition)
33512,Sports & Outdoors,Camping Arizona: A Comprehensive Guide To Public Tent And RV Campgrounds (State Camping Series)
40162,"Cookbooks, Food & Wine","Better Homes and Gardens New Cook Book, Sixteenth Edition (Better Homes and Gardens Plaid)"
10631,Travel,1001+ Basic Phrases English - Estonian
5207,Travel,Indonesia Islands of the Imagination
36576,Science & Math,The Bravest Dog Ever: The True Story of Balto (Book and CD)
12771,Science & Math,Passionate Nomad: The Life of Freya Stark (Modern Library Paperbacks)
26793,Science & Math,"Polarized Light, Third Edition"
2583,Travel,"I found Africa,"
15278,Travel,"Oahu Revealed: The Ultimate Guide to Honolulu, Waikiki & Beyond"
27640,Romance,El amante japonés: Una novela (Spanish Edition)
8759,Travel,Go de Rass to Sleep: (A Jamaican translation)
24999,Science & Math,Mathematics by Experiment: Plausible Reasoning in the 21st Century
43228,Science & Math,Make Your Juicer Your Drug Store
20946,Science & Math,Differential Ion Mobility Spectrometry: Nonlinear Ion Transport and Fundamentals of FAIMS
411,Travel,Lonely Planet USA's Best Trips (Travel Guide)
8089,Travel,Fodor's In Focus Aruba (Full-color Travel Guide)
17277,Travel,Moon Take a Hike Portland: Hikes within Two Hours of the City (Moon Outdoors)
35700,Travel,Beyond the Mountain
11277,Travel,Classicism and Biedermeier: Liechtenstein Museum Vienna (Liechtenstein Museum Vienna)
15486,Travel,A Guide to Chicago's Public Sculpture
41294,"Cookbooks, Food & Wine",Big Bob Gibson's BBQ Book: Recipes and Secrets from a Legendary Barbecue Joint
39165,"Cookbooks, Food & Wine",150 Best Desserts in a Jar
1768,Travel,Peaks and Valleys: A Solo Hike Across the Alps
19614,Science & Math,The Scientific Exploration of Mars
2363,Travel,"Algeria (Bradt Travel guides(Slow Travel))) by Oakes, Jonathan (2008) Paperback"
15471,Travel,Real City Chicago (Real City Guides)
22816,Science & Math,Gem and Crystal Treasures
21792,Science & Math,Organic Chemistry: A Guided Inquiry
4818,Travel,"Trekking in Nepal, West Tibet, and Bhutan"
28720,Romance,Obsidian (New Species)
22485,Science & Math,Igneous and Metamorphic Petrology
10473,Travel,Guide vert Danemark Suede [green guide Denmark Sweden] (French Edition)
31535,Romance,Mine (The REAL series)
9674,Travel,Lonely Planet Pocket Madrid (Travel Guide)
21080,Science & Math,Handbook of Derivatization Reactions for HPLC
9112,Travel,Moon Costa Rica (Moon Handbooks)
33192,"Cookbooks, Food & Wine","The Butterfly Garden: Turning Your Garden, Window Box or Backyard Into A Beautiful Home for Butterflies"
19249,Science & Math,Evidence of the Gods: A Visual Tour of Alien Influence in the Ancient World
35885,Travel,"Galveston Bay (Gulf Coast Books, sponsored by Texas A&M University-Corpus Christi)"
35729,Travel,Kilimanjaro - Kibo Climbing and Trekking Map: Including Moshi & Arusha City Plans
18548,"Cookbooks, Food & Wine",Everything I Want To Do Is Illegal: War Stories from the Local Food Front
20270,Science & Math,"Proceedings of the 1994 International Symposium on Charge and Field Effects in Biosystems-4: Virginia Commonwealth University, Richmond, Virginia 20 (v. 4)"
4681,Travel,Lonely Planet Bangladesh (Country Guide)
44466,Romance,Out of Old Nova Scotia Kitchens
2038,Travel,International Scholarship Directory: The Complete Guide to Financial Aid for Study Anywhere in the World (Dan Cassidy's Worldwide College Scholarship Directory)
43095,"Cookbooks, Food & Wine",14 Extra Special Winter Holidays Fondue Recipes
42861,"Cookbooks, Food & Wine","The Cast Iron Recipe Collection: 47 Yummy Recipes For Breakfast, Lunch, Dinner And Dessert In Your Cast Iron Skillet"
18148,Travel,Madeline Island ABC Coloring Book
15972,Travel,"Streetwise Baltimore Map - Laminated City Center Street Map of Baltimore, Maryland - Folding pocket size travel map with light rail & metro"
8106,Travel,Aruba Travel Adventures
3304,Travel,Madagascar (Cartographia International Road Map)
22501,Science & Math,What Really Causes Global Warming: Greenhouse Gases or Ozone Depletion?
23611,Science & Math,Evaluation Methodology Basics: The Nuts and Bolts of Sound Evaluation
34811,Science & Math,Novak Djokovic and the Rise of Serbia: The Sporting Statesman
21394,Science & Math,"Environmental Geochemistry: Treatise on Geochemistry, Second Edition, Volume 9"
32480,Sports & Outdoors,Coaching YMCA Rookies Basketball
5600,Travel,Maldives Insight Pocket Guide
19987,Science & Math,Cultural Anthropology (14th Edition)
46027,"Cookbooks, Food & Wine",Williams-Sonoma Foods of the World: New Orleans: Authentic Recipes Celebrating the Foods of the World
2672,Travel,The Democratic Republic of the Congo Travel Journal
6882,Travel,Turkmenistan Country Study Guide (World Country Study
30030,Romance,His Brother's Wife: Days of the Judges Volume 2
8386,Travel,Frommer's Bermuda 2007 (Frommer's Complete Guides)
10074,Travel,Croatia/Slovenia Marco Polo Map (Marco Polo Maps)
16715,Travel,American Map Southern New Hampshire: Street Atlas
31421,Romance,Wicked Lies: A Men of Summer Novel
13636,Travel,"Los Glaciares National Park Travel & Trekking Guide: Fitz Roy, Cerro Torre, Patagonian Ice Cap, Patagonia, Calafate, Chalten"
30891,Romance,Stealing the Preacher
22510,Travel,Introducing Geomorphology: A Guide to Landforms and Processes
43453,"Cookbooks, Food & Wine",The Breakfast Book
40608,"Cookbooks, Food & Wine",Microwave Baking and Desserts (Microwave Cooking Library)
21547,Science & Math,Periodic Table with Chemistry Formulas SparkCharts
34300,Travel,Tina Tumbles
6618,Travel,Hong Kong-Singapore-Bangkok
25553,Science & Math,Wildflowers and Ferns of Indiana Forests: A Field Guide (Indiana Natural Science)
565,"Cookbooks, Food & Wine",Cinnamon Mornings and Chocolate Dreams
18468,Science & Math,Chicken Health For Dummies
24583,Science & Math,MATLAB Matrix Algebra (Matlab Solutions)
20116,Science & Math,Macrocognition Metrics and Scenarios
5919,Travel,A Beard In Nepal 2: Return to the Village
12225,Travel,Nights of Awe (An Ariel Kafka Mystery)
44677,"Cookbooks, Food & Wine",Tamales: Fast and Delicious Mexican Meals
27662,Romance,Christmas in Mustang Creek (The Brides of Bliss County)
19113,Science & Math,Tropical Plant Science
13965,Romance,The Fruit Palace
186,Travel,A Paddler's Guide to Eastern North Carolina
12889,Travel,"Siwa: Jewelry, Costume, and Life in an Egyptian Oasis"
45515,"Cookbooks, Food & Wine",The Kosher Palette: Easy and Elegant Modern Kosher Cooking
6931,Travel,Tuttle Pocket Vietnamese Dictionary: Vietnamese-English English-Vietnamese
17822,Travel,Vermont Roads & Recreation
13691,Travel,Lonely Planet Argentina (Travel Guide) (Spanish Edition)
4661,Travel,Ganges
46325,"Cookbooks, Food & Wine",Cape Cod Chef's Table: Extraordinary Recipes From Buzzards Bay To Provincetown
22818,Science & Math,Earth Materials: Introduction to Mineralogy and Petrology
13587,Travel,Top 10 Buenos Aires (Eyewitness Top 10 Travel Guide)
5557,Travel,Malways: Maldives Island Directory
15469,Travel,For Members Only: A History And Guide to Chicago's Oldest Private Clubs
22708,Science & Math,"Soil Liquefaction: A Critical State Approach, Second Edition (Applied Geotechnics)"
14378,Travel,100 Things to Do in the Twin Cities Before You Die
231,Travel,"Atlanta Walks: A Comprehensive Guide to Walking, Running, and Bicycling the Area's Scenic and Historic Locales"
35048,Science & Math,Take Time for Paradise: Americans and Their Games
45710,"Cookbooks, Food & Wine","Diabetic Cookbook: Easy, Healthy, and Delicious Recipes for a Diabetes Diet"
32170,Sports & Outdoors,"B for Berea: Volume 1 - Triumph and Toil, 1895-1969: The Amazing Story of Berea College Basketball in the Words of the Men Who Played It (v. 1)"
9292,Travel,In America per il Touring. El Salvador.
24164,Science & Math,"Bayesian Data Analysis, Third Edition (Chapman & Hall/CRC Texts in Statistical Science)"
3598,Travel,Atlas of Namibia: A Portrait of the Land and its People
36027,Travel,Final Wicket: Test and First Class Cricketers Killed in the Great War
33656,"Cookbooks, Food & Wine","Dynamic Nymphing: Tactics, Techniques, and Flies from Around the World"
44629,"Cookbooks, Food & Wine",Monet's Table: The Cooking Journals of Claude Monet
41131,"Cookbooks, Food & Wine",25 Essentials: Techniques for Grilling Fish
32219,Science & Math,"Ain't No Tomorrow : Kobe, Shaq, and the Making of a Lakers Dynasty"
31907,Sports & Outdoors,"SAS Survival Guide 2E (Collins Gem): For any climate, for any situation"
7993,Travel,"Antigua and the Antiguans: a Full Account of the Colony and its Inhabitants from the Time of the Caribs to the Present Day, Interspersed with Anecdotes and Legends: Volume 2"
41360,"Cookbooks, Food & Wine","The Wholesome Baby Food Guide: Over 150 Easy, Delicious, and Healthy Recipes from Purees to Solids"
7412,Romance,Awakening Heart (Portraits Series #1)
1364,Travel,Hong Kong Tuttle Travel Pack: Your Guide to Hong Kong's Best Sights for Every Budget (Travel Guide & Map)
2919,Travel,Senegal (Enchantment of the World)
18530,Science & Math,Inositol Phosphates: Linking Agriculture and the Environment
30473,Romance,My Fair Viking
45486,"Cookbooks, Food & Wine",The Covenant Kitchen: Food and Wine for the New Jewish Table
33845,Sports & Outdoors,ProActive Archery
9965,Travel,Bruges City Guide 2015
42161,"Cookbooks, Food & Wine",36 Halloween Shots & Shooters
14489,Travel,Moon Coastal Maine: Including Acadia National Park
27105,Science & Math,Design of Integrated Circuits for Optical Communications
30556,Romance,All I Want for Christmas is a Cowboy
25106,Science & Math,Introduction to the Analysis of Metric Spaces (Australian Mathematical Society Lecture Series)
25238,Science & Math,Amsco's Algebra 2 and Trigonometry
21864,Science & Math,Understanding and Manipulating Excited-State Processes (Molecular and Supramolecular Photochemistry)
29849,Science & Math,"Absalom, Absalom! (Modern Library)"
12090,Travel,"Croatia, Bosnia-Herzegovina, Serbia, Montenegro 1:650,000 Map by ADAC"
35263,Sports & Outdoors,The Jewish Olympics: The History of the Maccabiah Games
5512,Travel,AZU's Dreams of Malaysia Kuala Lumpur (Dreams of)
41946,"Cookbooks, Food & Wine",Bite Size: Elegant Recipes for Entertaining
33861,Sports & Outdoors,Archery: Skills. Tactics. Techniques (Crowood Sports Guides)
10145,Travel,DK Eyewitness Travel Guide: Bulgaria
28062,Romance,Beautiful Sacrifice: A Novel (Maddox Brothers) (Volume 3)
12241,"Cookbooks, Food & Wine",The Best Concertina Method Yet
326,Sports & Outdoors,Lonely Planet : Diving & Snorkeling Belize
18758,Travel,From Can See to Can't: Texas Cotton Farmers on the Southern Prairies
38018,Travel,The Breath of a Wok
40539,Science & Math,"On-Premise Catering: Hotels, Convention & Conference Centers, and Clubs"
26666,Science & Math,"Relativistic Quantum Theory of Atoms and Molecules: Theory and Computation (Springer Series on Atomic, Optical, and Plasma Physics)"
25687,Science & Math,Fresh Pond: The History of a Cambridge Landscape
8331,Travel,Frommer's Bermuda (Frommer's Complete Guides)
5243,Travel,"Toraja: Misadventures of a Social Anthropologist in Sulawesi, Indonesia"
16971,Travel,Invisible New York: The Hidden Infrastructure of the City (Creating the North American Landscape)
45703,"Cookbooks, Food & Wine",Cooking Without a Grain of Salt
38415,"Cookbooks, Food & Wine",The Best of Thailand: A Cookbook
12878,Travel,"The Unexpected Circumnavigation: Unusual Boat, Unusual People Part 2 - Australia to Oman"
20800,Science & Math,Alkaloids: Chemical and Biological Perspectives
28854,Sports & Outdoors,More Housewives at Play  (v. 2)
23387,Science & Math,Mathematics for Finance: An Introduction to Financial Engineering (Springer Undergraduate Mathematics Series)
6506,Travel,LUXE Sri Lanka (LUXE City Guides)
18866,Science & Math,Bt Resistance: Characterization and Strategies for GM Crops Expressing Bacillus thuringiensis Toxins (CABI Biotechnology Series)
42045,"Cookbooks, Food & Wine",The Martha Stewart Living Christmas Cookbook
5261,Travel,Fodor's Tokyo (Full-color Travel Guide)
22435,Travel,Fire Mountains of the West: The Cascade And Mono Lake Volcanoes
38142,"Cookbooks, Food & Wine",Vegan Indian Cooking: 140 Simple and Healthy Vegan Recipes
40805,"Cookbooks, Food & Wine",Raw for Dessert: Easy Delights for Everyone
18339,Science & Math,Beyond Words: What Animals Think and Feel
12092,Travel,Montenegro: Quick Tourist Guide (Visit Montenegro) (Volume 3)
5734,Travel,Mongolian Journey
2855,Travel,In Ethiopia with a Mule
42569,Science & Math,Italian Vocabulary (Quickstudy: Academic)
24863,Science & Math,Chenier's Practical Math Dictionary
26574,Science & Math,Kinetic Theory of Gases and Plasmas (Fundamental Theories of Physics)
30870,Romance,When Dreams Cross (Second Chances Series #2)
24562,Science & Math,A Course in Metric Geometry
5914,Travel,The Living Goddess: A Journey Into the Heart of Kathmandu
37281,Sports & Outdoors,Creation de l'Ultime Joueur d'Arts Martiaux Mixtes: Decouvrez les secrets et les astuces utilises par les meilleurs Joueurs et Professionnels d?Arts ... et votre Tenacite Mentale (French Edition)
20315,Science & Math,Campbell Biology: Concepts & Connections (7th Edition)
25010,Science & Math,Reconstructing School Mathematics: Problems with Problems and the Real  World
45684,"Cookbooks, Food & Wine","The 1200-Calorie-a-Day Menu Cookbook : Quick and Easy Recipes for Delicious Low-fat Breakfasts, Lunches, Dinners, and Desserts"
46281,"Cookbooks, Food & Wine",Cooking with the Sassy Mama
31383,Romance,Put a Ring On It (Black Dog Bay Novel)
23002,Science & Math,"The Practical Encyclopedia of Rocks and Minerals: How to Find, Identify, Collect and Preserve the World's Best Specimens, with Over 1000 Photographs and Artworks"
44091,Travel,The Scout's Deck of Outdoor Recipe Cards
19202,Travel,"How to Read Egyptian Hieroglyphs: A Step-by-Step Guide to Teach Yourself, Revised Edition"
37939,"Cookbooks, Food & Wine",Are We Having Any Fun Yet?: The Cooking & Partying Handbook
38987,"Cookbooks, Food & Wine",Hoppin' John's Lowcountry Cooking: Recipes and Ruminations from Charleston and the Carolina Coastal Plain
41024,"Cookbooks, Food & Wine",The Great Book of Chocolate
17301,Travel,Backpacking Oregon
34783,Travel,Skater
26740,Science & Math,The Geometry of Minkowski Spacetime: An Introduction to the Mathematics of the Special Theory of Relativity (Applied Mathematical Sciences)
27599,Sports & Outdoors,The World Is Flat 3.0: A Brief History of the Twenty-first Century
42934,"Cookbooks, Food & Wine","Dehydrating Foods, Fruits, Vegetables, Fish and Meats: The New Easy, Economical and Superior Method of Preserving All Kinds of Food Materials, With a ... Recipes for Everyday Use (Classic Reprint)"
8029,Travel,Antigua and Barbuda Country Study Guide (World Country
33349,Science & Math,"Astrometric Techniques: Proceedings of the 109th Symposium of the International Astronomical Union Held in Gainesville, Florida, U.S.A., 9-12 January 1984 (International Astronomical Union Symposia)"
43989,"Cookbooks, Food & Wine",Southern Living Ultimate Book of BBQ: The Complete Year-Round Guide to Grilling and Smoking
16243,Travel,Minnesota Day Trips by Theme
22979,Science & Math,A Field Guide to Rocks and Minerals (Peterson Field Guides)
8456,Travel,Chariots of Chrome: Classic American Cars of Cuba
9018,Travel,Top 10 US & British Virgin Islands (Eyewitness Top 10 Travel Guide)
11484,Travel,St.Paul's Last Journey
25263,Travel,Behind the Dolphin Smile: One Man's Campaign to Protect the World's Dolphins
1155,Travel,Miss Passport City Guides Presents:  Mini 3 day Unforgettable Vacation  Itinerary to Cabo San Lucas Mexica (Miss Passport Travel Guides)
8898,Travel,San Juan Islands: Including Victoria and the Gulf Islands (Moon San Juan Islands)
12488,Travel,"Frommer's Portable Acapulco, Ixtapa & Zihuatenejo"
10078,Travel,Slovenia/Croatia/Serbia/Bosnia-Herzegovina/Montenegro/Macedonia
39496,"Cookbooks, Food & Wine",Empire of Tea: The Asian Leaf that Conquered the World
44077,Romance,Over the Open Fire
14597,Travel,"American Map Gadsden/ Anniston, Al Pocket Map"
41762,"Cookbooks, Food & Wine","Eat Green Get Lean: 100 Vegetarian and Vegan Recipes for Building Muscle, Getting Lean and Staying Healthy"
11539,Travel,"Guide To The Riviera From Hyères To Viareggio. With Map Of The Riviera And Street Plans Of Hyères, Cannes, Nice, Monaco And Monte Carlo, Menton, San Remo And Genoa. Numerous Illustrations"
4136,Travel,Kilimanjaro: Summit of Africa
7158,Travel,An Ocean in a Cup
40324,"Cookbooks, Food & Wine",Eat Your Vegetables: Bold Recipes for the Single Cook
11666,Travel,Top 14 Places to Visit in Poland - Top 14 Poland Travel Guide
16719,Travel,Fun with the Family in Vermont and New Hampshire: Hundreds of Ideas for Day Trips with the Kids (Fun with the Family Series)
26219,Science & Math,An Exploration of Dynamical Systems and Chaos: Completely Revised and Enlarged Second Edition
13447,Travel,By Daniel Mclaughlin Yemen (Bradt Travel Guide) (1st First Edition) [Paperback]
15099,Travel,Philadelphia With Children: A Guide to the Delaware Valley Including Lancaster and Hershey
14376,Travel,Black Hills National Forest [Map Pack Bundle] (National Geographic Trails Illustrated Map)
43076,"Cookbooks, Food & Wine","Dips: Great Recipes for Spreads, Salsas, Fondues and Other Party Fare"
39479,"Cookbooks, Food & Wine",Victoria The Essential Tea Companion: Favorite Recipes for Tea Parties and Celebrations
35707,Travel,"Glacier Travel & Crevasse Rescue: Reading Glaciers, Team Travel, Crevasse Rescue Techniques, Routefinding, Expedition Skills 2nd Edition"
21949,Science & Math,Polymers and Neutron Scattering (Oxford Series on Neutron Scattering in Condensed Matter)
27756,Science & Math,The Female Quixote: or The Adventures of Arabella (Oxford World's Classics)
16988,Travel,"Hidden Carolinas: Including Ashville, Great Smoky Mountains, Outer Banks, and Charleston"
29015,Travel,I Am a Woman
15622,Travel,"Iowa Off the Beaten Path, 8th (Off the Beaten Path Series)"
2093,Travel,"The Hidden Magic of Walt Disney World Planner: A Complete Organizer, Journal, and Keepsake for Your Unforgettable Vacation"
42762,"Cookbooks, Food & Wine","Easy Bread Machine Recipes: For 1, 1/2 & 2 Lb. Machines"
45156,"Cookbooks, Food & Wine",The Back in the Swing Cookbook: Recipes for Eating and Living Well Every Day After Breast Cancer
36056,Sports & Outdoors,How to Play Hockey: A Step-By-Step Guide (Jarrold Sports)
10362,Travel,Top 10 Prague (EYEWITNESS TOP 10 TRAVEL GUIDE)
2957,Travel,Dakar City Map
29251,Romance,Distance Means Little to Love
17500,Travel,South Carolina's Plantations & Historic Homes
22161,Science & Math,Scientific American Environmental Science for a Changing World
7922,Travel,"Laminated Aruba Map by Borch (English, Spanish, French, Italian and German Edition)"
33832,Romance,"Now, ...: Ramblings fron the Old Derelict Bowhunter"
4140,Travel,"Mediterranean Winter: The Pleasures of History and Landscape in Tunisia, Sicily, Dalmatia, and the Peloponnese"
19354,Travel,National Geographic Backyard Guide to the Night Sky
5090,Travel,Groovy Map 'n' Guide Hong Kong (2012)
16272,Travel,Moon Minneapolis and St. Paul (Moon Handbooks)
26438,Science & Math,Engineering Physics Part 1 1E
29854,Romance,The Paradise of Glass (The Glassblower Trilogy)
21104,Science & Math,"HPLC: Practical and Industrial Applications, Second Edition (Analytical Chemistry)"
44708,"Cookbooks, Food & Wine",Pati's Mexican Table: The Secrets of Real Mexican Home Cooking
1627,Travel,Signs & Shrines: Spiritual Journeys Across New Mexico
18347,Science & Math,Campbell Biology (10th Edition)
28310,Romance,Z-Rated: Chocolate Flava 3 (Zane Presents)
38095,"Cookbooks, Food & Wine",The Thousand Recipe Chinese Cookbook
43439,"Cookbooks, Food & Wine",The Ultimate Soups & Stews Book: More than 400 Satisfying Meals in a Bowl (Better Homes and Gardens Ultimate)
29616,Romance,Maizy the Bear Charmer [Divine Creek Ranch 16] (Siren Publishing Menage Everlasting)
36221,Travel,Rala: A Life in Rugby
29402,Romance,The Killer Wore Leather: A Mystery
36236,Sports & Outdoors,"Rugger - The History, Theory and Practice of Rugby Football"
492,Travel,SkyMaul: Happy Crap You Can Buy from a Plane
25388,Travel,Finding Abbey: The Search for Edward Abbey and His Hidden Desert Grave
14576,Travel,Alabama: Off the Beaten Path (3rd ed)
26745,Science & Math,Optics (4th Edition)
28657,Romance,"Warrior (The Cat Star Chronicles, Book 2)"
3412,Travel,Frommer's Morocco (Frommer's Complete Guides)
15649,Travel,A Few Words From Early Immigrants (Norwegian Emigration Literature)
41353,"Cookbooks, Food & Wine","Edible Wild Plants: Wild Foods From Dirt To Plate (The Wild Food Adventure Series, Book 1)"
11439,Travel,Belgium and Luxembourg Blue Guide
36751,Travel,Lonely Planet Queensland & the Great Barrier Reef (Travel Guide)
14093,Travel,Through Indian eyes;: A journey among the Indian tribes of Guiana
823,Travel,Fodor's Arizona & the Grand Canyon 2016 (Full-color Travel Guide)
3274,Travel,Madagascar Travel Guide
15069,Travel,Bucks County & the Delaware River Valley Alive
20370,Science & Math,"Biofluid Mechanics, Second Edition: An Introduction to Fluid Mechanics, Macrocirculation, and Microcirculation (Biomedical Engineering)"
46062,"Cookbooks, Food & Wine",Chef Paul Prudhomme's Pure Magic
23094,Science & Math,Waste Incineration & Public Health
24690,Science & Math,"Clifford (Geometric) Algebras With Applications in Physics, Mathematics, and Engineering"
33452,Travel,Lonely Planet Trekking in the Patagonian Andes (Travel Guide)
9745,Travel,"Costa Brava - Andorra, Perpignan, Barcelona Marco Polo Map (Marco Polo Maps)"
29421,Romance,Heights of Desire: Book 1 of the Heightsbound Series (Volume 1)
12783,Travel,Conversational Arabic Quick and Easy: The Most Advanced Revolutionary Technique to Learn Lebanese Arabic Dialect! A Levantine Colloquial ... and Easy - Lebanese Dialect) (Arabic Edition)
40900,"Cookbooks, Food & Wine",The Cook's Illustrated Meat Cookbook
24030,Science & Math,The Oxford Handbook of Philosophy of Time (Oxford Handbooks)
29382,Sports & Outdoors,Dancing on the Edge
4092,Science & Math,Tanzania-Rwanda and Burundi 1:500K Nelles
32369,Travel,Baserunning
20550,Science & Math,The Illustrated Handbook of Fossils: A Practical Directory And Identification Aid To More Than 300 Plant And Animal Fossils
18884,Science & Math,"An Introduction to Nematodes: Plant Nematology (Pensoft Series Parasitologica, 3)"
4674,Travel,"North-East India and Bangladesh Nelles Map (English, French and German Edition)"
18788,Science & Math,Principles of Fruit and Nut Production (Modular Texts Series)
27785,Romance,The Other Side of the Pillow: A Novel
13601,Travel,Top 10 Rio de Janeiro (Eyewitness Top 10 Travel Guide)
35485,Sports & Outdoors,Mile Markers: The 26.2 Most Important Reasons Why Women Run
6083,Travel,"Winning The Minds: Travels through the terrorist recruiting grounds of Yemen, Pakistan, and the Somali border"
20188,Science & Math,Citizens of the Sea: Wondrous Creatures From the Census of Marine Life
42281,"Cookbooks, Food & Wine",4 Bloggers Dish: Passover: Modern Twists on Traditional Flavors
19288,Science & Math,The Essential Cosmic Perspective (7th Edition)
44335,"Cookbooks, Food & Wine",Taste of Africa: 70 Easy-To-Cook Recipes from an Undiscovered Cuisine (Creative Cooking Library)
41774,"Cookbooks, Food & Wine",Georgia Cooking in an Oklahoma Kitchen: Recipes from My Family to Yours
41673,"Cookbooks, Food & Wine",Risotto: More than 100 Recipes for the Classic Rice Dish of Northern Italy
28859,Romance,Mounting the Mothman (The Alien Sex Chronicles) (Volume 4)
17834,Travel,"American Map Windsor/Orange Counties, Vt Pocket Map"
34158,Sports & Outdoors,The Mountain Biker's Training Bible
31184,Romance,Almost Perfect: A BWWM Billionaire Single Parent Romance
36861,Science & Math,Inner Skiing: Revised Edition
33911,Romance,The Hustler
38107,"Cookbooks, Food & Wine",Henry Chung's Hunan Style Chinese Cookbook
25632,Science & Math,Artemia: Basic and Applied Biology (Biology of Aquatic Organisms)
4739,Travel,"The ""Daily Telegraph"" India Wall Map: With Bangladesh, Bhutan, Nepal, Pakistan and Sri Lanka"
22794,Science & Math,Removal of Algal Toxins from Drinking Water Using Ozone and Gac
22054,Science & Math,Firefighter's Handbook: Essentials of Firefighting
24281,Travel,Geometric Origami (Origami Books)
29674,Romance,Fire Falling (Air Awakens Series Book 2)
36318,Sports & Outdoors,Becoming Mentally Tougher In Volleyball by Using Meditation: Reach Your Potential by Controlling Your Inner Thoughts
12719,Science & Math,Yucatan at the Time of the Spanish Encounter: Relacion de Las Cosas de Yucatan (Multilingual Edition)
46000,"Cookbooks, Food & Wine",Chef Paul Prudhomme's Louisiana Tastes: Exciting Flavors from the State that Cooks
6793,Travel,Living in Istanbul
43041,"Cookbooks, Food & Wine","Healthy Recipes: Slow Cooker, Dutch Oven, Casserole, Lasagna, Braised, Gourmet Recipes"
18781,Science & Math,Garlic and Other Alliums: The Lore and The Science
2513,Travel,Angola (Bradt Travel Guide)
34816,Sports & Outdoors,A Champion's Mind: Lessons from a Life in Tennis
6927,Travel,Lao-English English-Lao Dictionary
33476,Sports & Outdoors,"Moon California Camping: The Complete Guide to More Than 1,400 Tent and RV Campgrounds (Moon Outdoors)"
10462,Travel,Out of Isak Dinesen in Africa: The Untold Story
1811,Travel,Lethal Passage: How the Travels of a Single Handgun Expose the Roots of America's Gun Crisis
4731,Travel,By Lonely Planet Lonely Planet Bangladesh (Travel Guide) (7th Edition)
